"id","author","pub.year","title","inc.abst.ahe","inc.abst.sem","inc.full.read","reason","found.by.ref","country","coding.sys","sepsis.def","org.fail.def","data.source","sample.frac.n.units","stud.pop.size","ex.crit.A","ex.crit.B","ex.crit.C","int.valid","study.year.1","study.year.2","study.year.3","study.year.4","study.year.5","study.year.6","study.year.7","study.year.8","study.year.9","study.year.10","study.year.11","avg.age.1","avg.age.2","avg.age.3","avg.age.4","avg.age.5","avg.age.6","avg.age.7","avg.age.8","avg.age.9","avg.age.10","avg.age.11","incid.1","incid.2","incid.3","incid.4","incid.5","incid.6","incid.7","incid.8","incid.9","incid.10","incid.11","severe.incid.1","severe.incid.2","severe.incid.3","severe.incid.4","severe.incid.5","severe.incid.6","severe.incid.7","severe.incid.8","severe.incid.9","severe.incid.10","severe.incid.11","note"
"249","Lee, J.-J.; Hahn, L.-J.; Kao, T.-P.; Liu, C.-H.; Cheng, S.-J.; Cheng, S.-L.; Chang, H.-H.; Jeng, J.-H.; Kok, S.-H.",2009,"Post-tooth extraction sepsis without locoregional infection--a population-based study in Taiwan.",0,0,NA,5,0,NA,NA,NA,NA,NA,NA,NA,NA,NA,NA,NA,NA,NA,NA,NA,NA,NA,NA,NA,NA,NA,NA,NA,NA,NA,NA,NA,NA,NA,NA,NA,NA,NA,NA,NA,NA,NA,NA,NA,NA,NA,NA,NA,NA,NA,NA,NA,NA,NA,NA,NA,NA,NA,NA,NA,NA
"250","Lehmann, Lutz E.; Book, Malte; Hartmann, Wolfgang; Weber, Stefan U.; Schewe, Jens-Christian; Klaschik, Sven; Hoeft, Andreas; Stuber, Frank",2009,"A MIF haplotype is associated with the outcome of patients with severe sepsis: a  case control study.",0,0,NA,2,0,NA,NA,NA,NA,NA,NA,NA,NA,NA,NA,NA,NA,NA,NA,NA,NA,NA,NA,NA,NA,NA,NA,NA,NA,NA,NA,NA,NA,NA,NA,NA,NA,NA,NA,NA,NA,NA,NA,NA,NA,NA,NA,NA,NA,NA,NA,NA,NA,NA,NA,NA,NA,NA,NA,NA,NA
"251","Lehmann, Lutz E.; Herpichboehm, Bernd; Kost, Gerald J.; Kollef, Marin H.; Stuber, Frank",2010,"Cost and mortality prediction using polymerase chain reaction pathogen detection  in sepsis: evidence from three observational trials.",0,0,NA,2,0,NA,NA,NA,NA,NA,NA,NA,NA,NA,NA,NA,NA,NA,NA,NA,NA,NA,NA,NA,NA,NA,NA,NA,NA,NA,NA,NA,NA,NA,NA,NA,NA,NA,NA,NA,NA,NA,NA,NA,NA,NA,NA,NA,NA,NA,NA,NA,NA,NA,NA,NA,NA,NA,NA,NA,NA
"252","Levine, E. M.; Ghai, V.; Barton, J. J.; Strom, C. M.",1999,"Intrapartum antibiotic prophylaxis increases the incidence of gram-negative neonatal sepsis.",0,0,NA,3,0,NA,NA,NA,NA,NA,NA,NA,NA,NA,NA,NA,NA,NA,NA,NA,NA,NA,NA,NA,NA,NA,NA,NA,NA,NA,NA,NA,NA,NA,NA,NA,NA,NA,NA,NA,NA,NA,NA,NA,NA,NA,NA,NA,NA,NA,NA,NA,NA,NA,NA,NA,NA,NA,NA,NA,NA
"253","Levine, Robert L.; LeClerc, Jacques R.; Bailey, Joan E.; Monberg, Matthew J.; Sarwat, Samiha",2008,"Venous and arterial thromboembolism in severe sepsis.",0,0,NA,2,0,NA,NA,NA,NA,NA,NA,NA,NA,NA,NA,NA,NA,NA,NA,NA,NA,NA,NA,NA,NA,NA,NA,NA,NA,NA,NA,NA,NA,NA,NA,NA,NA,NA,NA,NA,NA,NA,NA,NA,NA,NA,NA,NA,NA,NA,NA,NA,NA,NA,NA,NA,NA,NA,NA,NA,NA
"254","Levy, M. M.; Fink, M. P.; Marshall, J. C.; Abraham, E.; Angus, D.; Cook, D.; Cohen, J.; Opal, S. M.; Vincent, J. L.; Ramsay, G.; Conference, International Sepsis Definitions",2003,"2001 SCCM/ESICM/ACCP/ATS/SIS International Sepsis Definitions Conference",NA,NA,NA,NA,NA,NA,NA,NA,NA,NA,NA,NA,NA,NA,NA,NA,NA,NA,NA,NA,NA,NA,NA,NA,NA,NA,NA,NA,NA,NA,NA,NA,NA,NA,NA,NA,NA,NA,NA,NA,NA,NA,NA,NA,NA,NA,NA,NA,NA,NA,NA,NA,NA,NA,NA,NA,NA,NA,NA,NA,NA
"255","Linde-Zwirble, Walter T.; Angus, Derek C.",2004,"Severe sepsis epidemiology: sampling, selection, and society.",NA,NA,NA,NA,NA,NA,NA,NA,NA,NA,NA,NA,NA,NA,NA,NA,NA,NA,NA,NA,NA,NA,NA,NA,NA,NA,NA,NA,NA,NA,NA,NA,NA,NA,NA,NA,NA,NA,NA,NA,NA,NA,NA,NA,NA,NA,NA,NA,NA,NA,NA,NA,NA,NA,NA,NA,NA,NA,NA,NA,NA
"256","Lopez, Sergio; Wong, Yudy; Urbina, Luis; Gomez, Ivonne; Escobar, Flavia; Tinoco, Bernarda; Parrales, Alba",2013,"Quality in practice: preventing and managing neonatal sepsis in Nicaragua.",0,0,NA,2,0,NA,NA,NA,NA,NA,NA,NA,NA,NA,NA,NA,NA,NA,NA,NA,NA,NA,NA,NA,NA,NA,NA,NA,NA,NA,NA,NA,NA,NA,NA,NA,NA,NA,NA,NA,NA,NA,NA,NA,NA,NA,NA,NA,NA,NA,NA,NA,NA,NA,NA,NA,NA,NA,NA,NA,NA
"257","Lopez Sastre, J. B.; Coto Cotallo, D.; Fernandez Colomer, B.",2002,"Neonatal sepsis of nosocomial origin: an epidemiological study from the ""Grupo de Hospitales Castrillo"".",0,0,NA,3,0,NA,NA,NA,NA,NA,NA,NA,NA,NA,NA,NA,NA,NA,NA,NA,NA,NA,NA,NA,NA,NA,NA,NA,NA,NA,NA,NA,NA,NA,NA,NA,NA,NA,NA,NA,NA,NA,NA,NA,NA,NA,NA,NA,NA,NA,NA,NA,NA,NA,NA,NA,NA,NA,NA,NA,NA
"258","Lopez Sastre, J. B.; Coto Cotallo, G. D.; Fernandez Colomer, B.",2000,"Neonatal sepsis of vertical transmission: an epidemiological study from the ""Grupo de Hospitales Castrillo"".",0,0,NA,3,0,NA,NA,NA,NA,NA,NA,NA,NA,NA,NA,NA,NA,NA,NA,NA,NA,NA,NA,NA,NA,NA,NA,NA,NA,NA,NA,NA,NA,NA,NA,NA,NA,NA,NA,NA,NA,NA,NA,NA,NA,NA,NA,NA,NA,NA,NA,NA,NA,NA,NA,NA,NA,NA,NA,NA,NA
"259","Lopez Sastre, Jose B.; Fernandez Colomer, Belen; Coto Cotallo, Gilan D.; Ramos Aparicio, Antonio",2005,"Trends in the epidemiology of neonatal sepsis of vertical transmission in the era of group B streptococcal prevention.",0,0,NA,3,0,NA,NA,NA,NA,NA,NA,NA,NA,NA,NA,NA,NA,NA,NA,NA,NA,NA,NA,NA,NA,NA,NA,NA,NA,NA,NA,NA,NA,NA,NA,NA,NA,NA,NA,NA,NA,NA,NA,NA,NA,NA,NA,NA,NA,NA,NA,NA,NA,NA,NA,NA,NA,NA,NA,NA,NA
"260","Lowry, J. B.; Voitk, A. J.",1985,"Fatal, overwhelming sepsis after splenectomy in the community hospital.",0,0,NA,5,0,NA,NA,NA,NA,NA,NA,NA,NA,NA,NA,NA,NA,NA,NA,NA,NA,NA,NA,NA,NA,NA,NA,NA,NA,NA,NA,NA,NA,NA,NA,NA,NA,NA,NA,NA,NA,NA,NA,NA,NA,NA,NA,NA,NA,NA,NA,NA,NA,NA,NA,NA,NA,NA,NA,NA,NA
"261","Lukacs, Susan L.; Schrag, Stephanie J.",2012,"Clinical sepsis in neonates and young infants, United States, 1988-2006.",0,0,NA,3,0,NA,NA,NA,NA,NA,NA,NA,NA,NA,NA,NA,NA,NA,NA,NA,NA,NA,NA,NA,NA,NA,NA,NA,NA,NA,NA,NA,NA,NA,NA,NA,NA,NA,NA,NA,NA,NA,NA,NA,NA,NA,NA,NA,NA,NA,NA,NA,NA,NA,NA,NA,NA,NA,NA,NA,NA
"262","Ma, P.; Delaney, W. E.; Grace, W. J.",1974,"Incidence of septicemia in patients with cardiac pacemakers.",0,0,NA,5,0,NA,NA,NA,NA,NA,NA,NA,NA,NA,NA,NA,NA,NA,NA,NA,NA,NA,NA,NA,NA,NA,NA,NA,NA,NA,NA,NA,NA,NA,NA,NA,NA,NA,NA,NA,NA,NA,NA,NA,NA,NA,NA,NA,NA,NA,NA,NA,NA,NA,NA,NA,NA,NA,NA,NA,NA
"263","Majuran, M.; Clancy, M.",2008,"Determination of the size of the different sepsis categories presenting to a UK teaching hospital emergency department.",1,0,0,2,0,NA,NA,NA,NA,NA,NA,NA,NA,NA,NA,NA,NA,NA,NA,NA,NA,NA,NA,NA,NA,NA,NA,NA,NA,NA,NA,NA,NA,NA,NA,NA,NA,NA,NA,NA,NA,NA,NA,NA,NA,NA,NA,NA,NA,NA,NA,NA,NA,NA,NA,NA,NA,NA,NA,NA,NA
"264","Maki, D. G.; Rhame, F. S.; Mackel, D. C.; Bennett, J. V.",1976,"Nationwide epidemic of septicemia caused by contaminated intravenous products. I. Epidemiologic and clinical features.",0,0,NA,2,0,NA,NA,NA,NA,NA,NA,NA,NA,NA,NA,NA,NA,NA,NA,NA,NA,NA,NA,NA,NA,NA,NA,NA,NA,NA,NA,NA,NA,NA,NA,NA,NA,NA,NA,NA,NA,NA,NA,NA,NA,NA,NA,NA,NA,NA,NA,NA,NA,NA,NA,NA,NA,NA,NA,NA,NA
"265","Manfredi, R.; Costigliola, P.; Ricchi, E.; Chiodo, F.",1993,"Sepsis-bacteraemia and other infections due to non-opportunistic bacterial pathogens in a consecutive series of 788 patients hospitalized for HIV infection.",0,0,NA,14,0,NA,NA,NA,NA,NA,NA,NA,NA,NA,NA,NA,NA,NA,NA,NA,NA,NA,NA,NA,NA,NA,NA,NA,NA,NA,NA,NA,NA,NA,NA,NA,NA,NA,NA,NA,NA,NA,NA,NA,NA,NA,NA,NA,NA,NA,NA,NA,NA,NA,NA,NA,NA,NA,NA,NA,NA
"266","Mangia, Cristina Malzoni Ferreira; Kissoon, Niranjan; Branchini, Otavio Augusto; Andrade, Maria Cristina; Kopelman, Benjamin Israel; Carcillo, Joe",2011,"Bacterial sepsis in Brazilian children: a trend analysis from 1992 to 2006.",0,0,NA,3,0,NA,NA,NA,NA,NA,NA,NA,NA,NA,NA,NA,NA,NA,NA,NA,NA,NA,NA,NA,NA,NA,NA,NA,NA,NA,NA,NA,NA,NA,NA,NA,NA,NA,NA,NA,NA,NA,NA,NA,NA,NA,NA,NA,NA,NA,NA,NA,NA,NA,NA,NA,NA,NA,NA,NA,NA
"267","Manzoni, Paolo; Rinaldi, Matteo; Cattani, Silvia; Pugni, Lorenza; Romeo, Mario Giovanni; Messner, Hubert; Stolfi, Ilaria; Decembrino, Lidia; Laforgia, Nicola; Vagnarelli, Federica; Memo, Luigi; Bordignon, Linda; Saia, Onofrio Sergio; Maule, Milena; Gallo, Elena; Mostert, Michael; Magnani, Cristiana; Quercia, Michele; Bollani, Lina; Pedicino, Roberto; Renzullo, Livia; Betta, Pasqua; Mosca, Fabio; Ferrari, Fabrizio; Magaldi, Rosario; Stronati, Mauro; Farina, Daniele",2009,"Bovine lactoferrin supplementation for prevention of late-onset sepsis in very low-birth-weight neonates: a randomized trial.",0,0,NA,2,0,NA,NA,NA,NA,NA,NA,NA,NA,NA,NA,NA,NA,NA,NA,NA,NA,NA,NA,NA,NA,NA,NA,NA,NA,NA,NA,NA,NA,NA,NA,NA,NA,NA,NA,NA,NA,NA,NA,NA,NA,NA,NA,NA,NA,NA,NA,NA,NA,NA,NA,NA,NA,NA,NA,NA,NA
"268","Mao, En-Qiang; Fei, Jian; Peng, Yi-Bing; Huang, Jie; Tang, Yao-Qing; Zhang, Sheng-Dao",2010,"Rapid hemodilution is associated with increased sepsis and mortality among patients with severe acute pancreatitis.",0,0,NA,5,0,NA,NA,NA,NA,NA,NA,NA,NA,NA,NA,NA,NA,NA,NA,NA,NA,NA,NA,NA,NA,NA,NA,NA,NA,NA,NA,NA,NA,NA,NA,NA,NA,NA,NA,NA,NA,NA,NA,NA,NA,NA,NA,NA,NA,NA,NA,NA,NA,NA,NA,NA,NA,NA,NA,NA,NA
"269","Marchick, Michael R.; Kline, Jeffrey A.; Jones, Alan E.",2009,"The significance of non-sustained hypotension in emergency department patients with sepsis.",0,0,NA,2,0,NA,NA,NA,NA,NA,NA,NA,NA,NA,NA,NA,NA,NA,NA,NA,NA,NA,NA,NA,NA,NA,NA,NA,NA,NA,NA,NA,NA,NA,NA,NA,NA,NA,NA,NA,NA,NA,NA,NA,NA,NA,NA,NA,NA,NA,NA,NA,NA,NA,NA,NA,NA,NA,NA,NA,NA
"270","Marshall, J. C.; Cook, D. J.; Christou, N. V.; Bernard, G. R.; Sprung, C. L.; Sibbald, W. J.",1995,"Multiple organ dysfunction score: a reliable descriptor of a complex clinical outcome",0,0,NA,2,1,NA,NA,NA,NA,NA,NA,NA,NA,NA,NA,NA,NA,NA,NA,NA,NA,NA,NA,NA,NA,NA,NA,NA,NA,NA,NA,NA,NA,NA,NA,NA,NA,NA,NA,NA,NA,NA,NA,NA,NA,NA,NA,NA,NA,NA,NA,NA,NA,NA,NA,NA,NA,NA,NA,NA,NA
"271","Martin, Greg S.; Mannino, David M.; Eaton, Stephanie; Moss, Marc",2003,"The epidemiology of sepsis in the United States from 1979 through 2000.",1,1,1,NA,0,"USA","ICD9",NA,NA,"NHDS",0.01,750000000,NA,NA,NA,1,1979,2000,NA,NA,NA,NA,NA,NA,NA,NA,NA,57.4,60.8,NA,NA,NA,NA,NA,NA,NA,NA,NA,82.7,240.4,NA,NA,NA,NA,NA,NA,NA,NA,NA,NA,NA,NA,NA,NA,NA,NA,NA,NA,NA,NA,NA
"272","Martin, Greg S.; Mannino, David M.; Moss, Marc",2006,"The effect of age on the development and outcome of adult sepsis.",1,0,0,2,0,NA,NA,NA,NA,NA,NA,NA,NA,NA,NA,NA,NA,NA,NA,NA,NA,NA,NA,NA,NA,NA,NA,NA,NA,NA,NA,NA,NA,NA,NA,NA,NA,NA,NA,NA,NA,NA,NA,NA,NA,NA,NA,NA,NA,NA,NA,NA,NA,NA,NA,NA,NA,NA,NA,NA,NA
"273","Martin, Greg S.",2012,"Sepsis, severe sepsis and septic shock: changes in incidence, pathogens and outcomes.",0,0,NA,1,0,NA,NA,NA,NA,NA,NA,NA,NA,NA,NA,NA,NA,NA,NA,NA,NA,NA,NA,NA,NA,NA,NA,NA,NA,NA,NA,NA,NA,NA,NA,NA,NA,NA,NA,NA,NA,NA,NA,NA,NA,NA,NA,NA,NA,NA,NA,NA,NA,NA,NA,NA,NA,NA,NA,NA,NA
"274","Mayo Clinic Staff",2014,"Sepsis Symptoms - Mayo Clinic",NA,NA,NA,NA,NA,NA,NA,NA,NA,NA,NA,NA,NA,NA,NA,NA,NA,NA,NA,NA,NA,NA,NA,NA,NA,NA,NA,NA,NA,NA,NA,NA,NA,NA,NA,NA,NA,NA,NA,NA,NA,NA,NA,NA,NA,NA,NA,NA,NA,NA,NA,NA,NA,NA,NA,NA,NA,NA,NA,NA,NA
"275","Mayr, Florian B.; Yende, Sachin; Linde-Zwirble, Walter T.; Peck-Palmer, Octavia M.; Barnato, Amber E.; Weissfeld, Lisa A.; Angus, Derek C.",2010,"Infection rate and acute organ dysfunction risk as explanations for racial differences in severe sepsis.",1,0,0,2,0,NA,NA,NA,NA,NA,NA,NA,NA,NA,NA,NA,NA,NA,NA,NA,NA,NA,NA,NA,NA,NA,NA,NA,NA,NA,NA,NA,NA,NA,NA,NA,NA,NA,NA,NA,NA,NA,NA,NA,NA,NA,NA,NA,NA,NA,NA,NA,NA,NA,NA,NA,NA,NA,NA,NA,NA
"276","McConnell, Kevin W.; Fox, Amy C.; Clark, Andrew T.; Chang, Nai-Yuan Nicholas; Dominguez, Jessica A.; Farris, Alton B.; Buchman, Timothy G.; Hunt, Clayton R.; Coopersmith, Craig M.",2011,"The role of heat shock protein 70 in mediating age-dependent mortality in sepsis.",0,0,NA,2,0,NA,NA,NA,NA,NA,NA,NA,NA,NA,NA,NA,NA,NA,NA,NA,NA,NA,NA,NA,NA,NA,NA,NA,NA,NA,NA,NA,NA,NA,NA,NA,NA,NA,NA,NA,NA,NA,NA,NA,NA,NA,NA,NA,NA,NA,NA,NA,NA,NA,NA,NA,NA,NA,NA,NA,NA
"277","McCoy, Christopher",2004,"Safety of drotrecogin alfa (activated) in the treatment of patients with severe sepsis.",0,0,NA,2,0,NA,NA,NA,NA,NA,NA,NA,NA,NA,NA,NA,NA,NA,NA,NA,NA,NA,NA,NA,NA,NA,NA,NA,NA,NA,NA,NA,NA,NA,NA,NA,NA,NA,NA,NA,NA,NA,NA,NA,NA,NA,NA,NA,NA,NA,NA,NA,NA,NA,NA,NA,NA,NA,NA,NA,NA
"278","Mehr, S. S.; Sadowsky, J. L.; Doyle, L. W.; Carr, J.",2002,"Sepsis in neonatal intensive care in the late 1990s.",0,0,NA,3,0,NA,NA,NA,NA,NA,NA,NA,NA,NA,NA,NA,NA,NA,NA,NA,NA,NA,NA,NA,NA,NA,NA,NA,NA,NA,NA,NA,NA,NA,NA,NA,NA,NA,NA,NA,NA,NA,NA,NA,NA,NA,NA,NA,NA,NA,NA,NA,NA,NA,NA,NA,NA,NA,NA,NA,NA
"279","Mehta, Ravindra L.; Bouchard, Josee; Soroko, Sharon B.; Ikizler, T. Alp; Paganini, Emil P.; Chertow, Glenn M.; Himmelfarb, Jonathan",2011,"Sepsis as a cause and consequence of acute kidney injury: Program to Improve Care in Acute Renal Disease.",0,0,NA,5,0,NA,NA,NA,NA,NA,NA,NA,NA,NA,NA,NA,NA,NA,NA,NA,NA,NA,NA,NA,NA,NA,NA,NA,NA,NA,NA,NA,NA,NA,NA,NA,NA,NA,NA,NA,NA,NA,NA,NA,NA,NA,NA,NA,NA,NA,NA,NA,NA,NA,NA,NA,NA,NA,NA,NA,NA
"280","Melamed, Alexander; Sorvillo, Frank J.",2009,"The burden of sepsis-associated mortality in the United States from 1999 to 2005: an analysis of multiple-cause-of-death data.",0,0,NA,2,0,NA,NA,NA,NA,NA,NA,NA,NA,NA,NA,NA,NA,NA,NA,NA,NA,NA,NA,NA,NA,NA,NA,NA,NA,NA,NA,NA,NA,NA,NA,NA,NA,NA,NA,NA,NA,NA,NA,NA,NA,NA,NA,NA,NA,NA,NA,NA,NA,NA,NA,NA,NA,NA,NA,NA,NA
"281","Mendes, E. W.; Procianoy, R. S.",2008,"Massage therapy reduces hospital stay and occurrence of late-onset sepsis in very preterm neonates.",0,0,NA,2,0,NA,NA,NA,NA,NA,NA,NA,NA,NA,NA,NA,NA,NA,NA,NA,NA,NA,NA,NA,NA,NA,NA,NA,NA,NA,NA,NA,NA,NA,NA,NA,NA,NA,NA,NA,NA,NA,NA,NA,NA,NA,NA,NA,NA,NA,NA,NA,NA,NA,NA,NA,NA,NA,NA,NA,NA
"282","Metsvaht, T.; Ilmoja, M.-L.; Parm, U.; Maipuu, L.; Merila, M.; Lutsar, I.",2010,"Comparison of ampicillin plus gentamicin vs. penicillin plus gentamicin in empiric treatment of neonates at risk of early onset sepsis.",0,0,NA,2,0,NA,NA,NA,NA,NA,NA,NA,NA,NA,NA,NA,NA,NA,NA,NA,NA,NA,NA,NA,NA,NA,NA,NA,NA,NA,NA,NA,NA,NA,NA,NA,NA,NA,NA,NA,NA,NA,NA,NA,NA,NA,NA,NA,NA,NA,NA,NA,NA,NA,NA,NA,NA,NA,NA,NA,NA
"283","Meyer, D. M.; Jessen, M. E.",1995,"Results of extracorporeal membrane oxygenation in neonates with sepsis. The Extracorporeal Life Support Organization experience.",0,0,NA,2,0,NA,NA,NA,NA,NA,NA,NA,NA,NA,NA,NA,NA,NA,NA,NA,NA,NA,NA,NA,NA,NA,NA,NA,NA,NA,NA,NA,NA,NA,NA,NA,NA,NA,NA,NA,NA,NA,NA,NA,NA,NA,NA,NA,NA,NA,NA,NA,NA,NA,NA,NA,NA,NA,NA,NA,NA
"284","Michalopoulos, A.; Stavridis, G.; Geroulanos, S.",1998,"Severe sepsis in cardiac surgical patients.",0,0,NA,5,0,NA,NA,NA,NA,NA,NA,NA,NA,NA,NA,NA,NA,NA,NA,NA,NA,NA,NA,NA,NA,NA,NA,NA,NA,NA,NA,NA,NA,NA,NA,NA,NA,NA,NA,NA,NA,NA,NA,NA,NA,NA,NA,NA,NA,NA,NA,NA,NA,NA,NA,NA,NA,NA,NA,NA,NA
"285","Mihatsch, Walter A.; Braegger, Christian P.; Decsi, Tamas; Kolacek, Sanja; Lanzinger, Hartmut; Mayer, Benjamin; Moreno, Luis A.; Pohlandt, Frank; Puntis, John; Shamir, Raanan; Stadtmuller, Ulrich; Szajewska, Hania; Turck, Dominique; van Goudoever, Johannes B.",2012,"Critical systematic review of the level of evidence for routine use of probiotics for reduction of mortality and prevention of necrotizing enterocolitis and sepsis in preterm infants.",0,0,NA,1,0,NA,NA,NA,NA,NA,NA,NA,NA,NA,NA,NA,NA,NA,NA,NA,NA,NA,NA,NA,NA,NA,NA,NA,NA,NA,NA,NA,NA,NA,NA,NA,NA,NA,NA,NA,NA,NA,NA,NA,NA,NA,NA,NA,NA,NA,NA,NA,NA,NA,NA,NA,NA,NA,NA,NA,NA
"286","Mikkelsen, Mark E.; Shah, Chirag V.; Meyer, Nuala J.; Gaieski, David F.; Lyon, Sarah; Miltiades, Andrea N.; Goyal, Munish; Fuchs, Barry D.; Bellamy, Scarlett L.; Christie, Jason D.",2013,"The epidemiology of acute respiratory distress syndrome in patients presenting to the emergency department with severe sepsis.",0,0,NA,2,0,NA,NA,NA,NA,NA,NA,NA,NA,NA,NA,NA,NA,NA,NA,NA,NA,NA,NA,NA,NA,NA,NA,NA,NA,NA,NA,NA,NA,NA,NA,NA,NA,NA,NA,NA,NA,NA,NA,NA,NA,NA,NA,NA,NA,NA,NA,NA,NA,NA,NA,NA,NA,NA,NA,NA,NA
"287","Mitsui, Hideki; Karasuno, Takahiro; Santo, Taisuke; Fukushima, Kentaro; Matsunaga, Hitomi; Nakamura, Hiroyuki; Hiraoka, Akira",2003,"Analysis of sepsis in allogeneic bone marrow transplant recipients: a single-center study.",0,0,NA,5,0,NA,NA,NA,NA,NA,NA,NA,NA,NA,NA,NA,NA,NA,NA,NA,NA,NA,NA,NA,NA,NA,NA,NA,NA,NA,NA,NA,NA,NA,NA,NA,NA,NA,NA,NA,NA,NA,NA,NA,NA,NA,NA,NA,NA,NA,NA,NA,NA,NA,NA,NA,NA,NA,NA,NA,NA
"288","Mokart, Djamel; Slehofer, Geraldine; Lambert, Jerome; Sannini, Antoine; Chow-Chine, Laurent; Brun, Jean-Paul; Berger, Pierre; Duran, Segolene; Faucher, Marion; Blache, Jean-Louis; Saillard, Colombe; Vey, Norbert; Leone, Marc",2014,"De-escalation of antimicrobial treatment in neutropenic patients with severe sepsis: results from an observational study.",0,0,NA,2,0,NA,NA,NA,NA,NA,NA,NA,NA,NA,NA,NA,NA,NA,NA,NA,NA,NA,NA,NA,NA,NA,NA,NA,NA,NA,NA,NA,NA,NA,NA,NA,NA,NA,NA,NA,NA,NA,NA,NA,NA,NA,NA,NA,NA,NA,NA,NA,NA,NA,NA,NA,NA,NA,NA,NA,NA
"289","Moore, Laura J.; Moore, Frederick A.; Todd, S. Rob; Jones, Stephen L.; Turner, Krista L.; Bass, Barbara L.",2010,"Sepsis in general surgery: the 2005-2007 national surgical quality improvement program perspective.",0,0,NA,2,0,NA,NA,NA,NA,NA,NA,NA,NA,NA,NA,NA,NA,NA,NA,NA,NA,NA,NA,NA,NA,NA,NA,NA,NA,NA,NA,NA,NA,NA,NA,NA,NA,NA,NA,NA,NA,NA,NA,NA,NA,NA,NA,NA,NA,NA,NA,NA,NA,NA,NA,NA,NA,NA,NA,NA,NA
"290","Moore, Matthew R.; Schrag, Stephanie J.; Schuchat, Anne",2003,"Effects of intrapartum antimicrobial prophylaxis for prevention of group-B-streptococcal disease on the incidence and ecology of early-onset neonatal sepsis.",0,0,NA,1,0,NA,NA,NA,NA,NA,NA,NA,NA,NA,NA,NA,NA,NA,NA,NA,NA,NA,NA,NA,NA,NA,NA,NA,NA,NA,NA,NA,NA,NA,NA,NA,NA,NA,NA,NA,NA,NA,NA,NA,NA,NA,NA,NA,NA,NA,NA,NA,NA,NA,NA,NA,NA,NA,NA,NA,NA
"291","Moreno, M. T.; Vargas, S.; Poveda, R.; Saez-Llorens, X.",1994,"Neonatal sepsis and meningitis in a developing Latin American country.",0,0,NA,2,0,NA,NA,NA,NA,NA,NA,NA,NA,NA,NA,NA,NA,NA,NA,NA,NA,NA,NA,NA,NA,NA,NA,NA,NA,NA,NA,NA,NA,NA,NA,NA,NA,NA,NA,NA,NA,NA,NA,NA,NA,NA,NA,NA,NA,NA,NA,NA,NA,NA,NA,NA,NA,NA,NA,NA,NA
"292","Morgan, G.; Ginks, W.; Siddons, H.; Leatham, A.",1979,"Septicemia in patients with an endocardial pacemaker.",0,0,NA,2,0,NA,NA,NA,NA,NA,NA,NA,NA,NA,NA,NA,NA,NA,NA,NA,NA,NA,NA,NA,NA,NA,NA,NA,NA,NA,NA,NA,NA,NA,NA,NA,NA,NA,NA,NA,NA,NA,NA,NA,NA,NA,NA,NA,NA,NA,NA,NA,NA,NA,NA,NA,NA,NA,NA,NA,NA
"293","Morioka, Ichiro; Morikawa, Satoru; Miwa, Akihiro; Minami, Hirotaka; Yoshii, Katsuhiko; Kugo, Masaaki; Kitsunezuka, Yoshiki; Enomoto, Miki; Jikimoto, Takumi; Nakamura, Masakuni; Yokoyama, Naoki; Nishio, Hisahide; Matsuo, Masafumi; Yamada, Hideto",2012,"Culture-proven neonatal sepsis in Japanese neonatal care units in 2006-2008.",0,0,NA,3,0,NA,NA,NA,NA,NA,NA,NA,NA,NA,NA,NA,NA,NA,NA,NA,NA,NA,NA,NA,NA,NA,NA,NA,NA,NA,NA,NA,NA,NA,NA,NA,NA,NA,NA,NA,NA,NA,NA,NA,NA,NA,NA,NA,NA,NA,NA,NA,NA,NA,NA,NA,NA,NA,NA,NA,NA
"294","Moss, Marc",2005,"Epidemiology of sepsis: race, sex, and chronic alcohol abuse.",0,0,NA,1,0,NA,NA,NA,NA,NA,NA,NA,NA,NA,NA,NA,NA,NA,NA,NA,NA,NA,NA,NA,NA,NA,NA,NA,NA,NA,NA,NA,NA,NA,NA,NA,NA,NA,NA,NA,NA,NA,NA,NA,NA,NA,NA,NA,NA,NA,NA,NA,NA,NA,NA,NA,NA,NA,NA,NA,NA
"295","Moxon, E. R.; Schwartz, A. D.",1980,"Heterotropic splenic autotransplantation in the prevention of Haemophilus influenza meningitis and fatal sepsis in Sprague-Dawley rats.",0,0,NA,2,0,NA,NA,NA,NA,NA,NA,NA,NA,NA,NA,NA,NA,NA,NA,NA,NA,NA,NA,NA,NA,NA,NA,NA,NA,NA,NA,NA,NA,NA,NA,NA,NA,NA,NA,NA,NA,NA,NA,NA,NA,NA,NA,NA,NA,NA,NA,NA,NA,NA,NA,NA,NA,NA,NA,NA,NA
"296","Mukhopadhyay, Sagori; Puopolo, Karen M.",2012,"Risk assessment in neonatal early onset sepsis.",0,0,NA,0,0,NA,NA,NA,NA,NA,NA,NA,NA,NA,NA,NA,NA,NA,NA,NA,NA,NA,NA,NA,NA,NA,NA,NA,NA,NA,NA,NA,NA,NA,NA,NA,NA,NA,NA,NA,NA,NA,NA,NA,NA,NA,NA,NA,NA,NA,NA,NA,NA,NA,NA,NA,NA,NA,NA,NA,NA
"297","Mullett, M. D.; Cook, E. F.; Gallagher, R.",1998,"Nosocomial sepsis in the neonatal intensive care unit.",0,0,NA,2,0,NA,NA,NA,NA,NA,NA,NA,NA,NA,NA,NA,NA,NA,NA,NA,NA,NA,NA,NA,NA,NA,NA,NA,NA,NA,NA,NA,NA,NA,NA,NA,NA,NA,NA,NA,NA,NA,NA,NA,NA,NA,NA,NA,NA,NA,NA,NA,NA,NA,NA,NA,NA,NA,NA,NA,NA
"298","Naito, H.; Toya, S.; Shizawa, H.; Iizaka, Y.; Tsukumo, D.",1973,"High incidence of acute postoperative meningitis and septicemia in patients undergoing craniotomy with ventriculoatrial shunt.",0,0,NA,5,0,NA,NA,NA,NA,NA,NA,NA,NA,NA,NA,NA,NA,NA,NA,NA,NA,NA,NA,NA,NA,NA,NA,NA,NA,NA,NA,NA,NA,NA,NA,NA,NA,NA,NA,NA,NA,NA,NA,NA,NA,NA,NA,NA,NA,NA,NA,NA,NA,NA,NA,NA,NA,NA,NA,NA,NA
"299","Naqvi, S. H.; Chundu, K. R.; Friedman, A. D.",1986,"Shock in children with gram-negative bacillary sepsis and Haemophilus influenzae  type b sepsis.",0,0,NA,1,0,NA,NA,NA,NA,NA,NA,NA,NA,NA,NA,NA,NA,NA,NA,NA,NA,NA,NA,NA,NA,NA,NA,NA,NA,NA,NA,NA,NA,NA,NA,NA,NA,NA,NA,NA,NA,NA,NA,NA,NA,NA,NA,NA,NA,NA,NA,NA,NA,NA,NA,NA,NA,NA,NA,NA,NA
"300","Nygard, Siri Tandberg; Langeland, Nina; Flaatten, Hans K.; Fanebust, Rune; Haugen, Oddbjorn; Skrede, Steinar",2014,"Aetiology, antimicrobial therapy and outcome of patients with community acquired  severe sepsis: a prospective study in a Norwegian university hospital.",1,1,1,NA,0,"Norway","Chart","Bone crit.","Bone crit.","ICU",3,NA,"<15 years","severe sepsis not present within 24 hrs from admission","transferred with diagnosis",NA,2008,NA,NA,NA,NA,NA,NA,NA,NA,NA,NA,67,NA,NA,NA,NA,NA,NA,NA,NA,NA,NA,NA,NA,NA,NA,NA,NA,NA,NA,NA,NA,NA,50,NA,NA,NA,NA,NA,NA,NA,NA,NA,NA,NA
"301","Oconnor, E.; Venkatesh, B.; Mashongonyika, C.; Lipman, J.; Hall, J.; Thomas, P.",2004,"Serum procalcitonin and C-reactive protein as markers of sepsis and outcome in patients with neurotrauma and subarachnoid haemorrhage.",0,0,NA,2,0,NA,NA,NA,NA,NA,NA,NA,NA,NA,NA,NA,NA,NA,NA,NA,NA,NA,NA,NA,NA,NA,NA,NA,NA,NA,NA,NA,NA,NA,NA,NA,NA,NA,NA,NA,NA,NA,NA,NA,NA,NA,NA,NA,NA,NA,NA,NA,NA,NA,NA,NA,NA,NA,NA,NA,NA
"302","Odio, C. M.",1995,"Cefotaxime for treatment of neonatal sepsis and meningitis.",0,0,NA,3,0,NA,NA,NA,NA,NA,NA,NA,NA,NA,NA,NA,NA,NA,NA,NA,NA,NA,NA,NA,NA,NA,NA,NA,NA,NA,NA,NA,NA,NA,NA,NA,NA,NA,NA,NA,NA,NA,NA,NA,NA,NA,NA,NA,NA,NA,NA,NA,NA,NA,NA,NA,NA,NA,NA,NA,NA
"303","Ogunlesi, Tinuade A.; Ogunfowora, Olusoga B.; Osinupebi, Olubunmi; Olanrewaju, Durotoye M.",2011,"Changing trends in newborn sepsis in Sagamu, Nigeria: bacterial aetiology, risk factors and antibiotic susceptibility.",0,0,NA,3,0,NA,NA,NA,NA,NA,NA,NA,NA,NA,NA,NA,NA,NA,NA,NA,NA,NA,NA,NA,NA,NA,NA,NA,NA,NA,NA,NA,NA,NA,NA,NA,NA,NA,NA,NA,NA,NA,NA,NA,NA,NA,NA,NA,NA,NA,NA,NA,NA,NA,NA,NA,NA,NA,NA,NA,NA
"304","Ohlsson, A.; Bailey, T.; Takieddine, F.",1986,"Changing etiology and outcome of neonatal septicemia in Riyadh, Saudi Arabia.",0,0,NA,3,0,NA,NA,NA,NA,NA,NA,NA,NA,NA,NA,NA,NA,NA,NA,NA,NA,NA,NA,NA,NA,NA,NA,NA,NA,NA,NA,NA,NA,NA,NA,NA,NA,NA,NA,NA,NA,NA,NA,NA,NA,NA,NA,NA,NA,NA,NA,NA,NA,NA,NA,NA,NA,NA,NA,NA,NA
"305","Ohlsson, A.; Serenius, F.",1981,"Neonatal septicemia in Riyadh, Saudi Arabia.",0,0,NA,1,0,NA,NA,NA,NA,NA,NA,NA,NA,NA,NA,NA,NA,NA,NA,NA,NA,NA,NA,NA,NA,NA,NA,NA,NA,NA,NA,NA,NA,NA,NA,NA,NA,NA,NA,NA,NA,NA,NA,NA,NA,NA,NA,NA,NA,NA,NA,NA,NA,NA,NA,NA,NA,NA,NA,NA,NA
"306","Ojukwu, Juliana U.; Abonyi, Leonard E.; Ugwu, Jude; Orji, Ikechukwu K.",2006,"Neonatal septicemia in high risk babies in South-Eastern Nigeria.",0,0,NA,3,0,NA,NA,NA,NA,NA,NA,NA,NA,NA,NA,NA,NA,NA,NA,NA,NA,NA,NA,NA,NA,NA,NA,NA,NA,NA,NA,NA,NA,NA,NA,NA,NA,NA,NA,NA,NA,NA,NA,NA,NA,NA,NA,NA,NA,NA,NA,NA,NA,NA,NA,NA,NA,NA,NA,NA,NA
"307","Okascharoen, Chusak; Sirinavin, Sayomporn; Thakkinstian, Ammarin; Kitayaporn, Dwip; Supapanachart, Sarayut",2005,"A bedside prediction-scoring model for late-onset neonatal sepsis.",0,0,NA,3,0,NA,NA,NA,NA,NA,NA,NA,NA,NA,NA,NA,NA,NA,NA,NA,NA,NA,NA,NA,NA,NA,NA,NA,NA,NA,NA,NA,NA,NA,NA,NA,NA,NA,NA,NA,NA,NA,NA,NA,NA,NA,NA,NA,NA,NA,NA,NA,NA,NA,NA,NA,NA,NA,NA,NA,NA
"308","O'Keefe, Grant E.; Hybki, Dixie L.; Munford, Robert S.",2002,"The G-->A single nucleotide polymorphism at the -308 position in the tumor necrosis factor-alpha promoter increases the risk for severe sepsis after trauma.",0,0,NA,2,0,NA,NA,NA,NA,NA,NA,NA,NA,NA,NA,NA,NA,NA,NA,NA,NA,NA,NA,NA,NA,NA,NA,NA,NA,NA,NA,NA,NA,NA,NA,NA,NA,NA,NA,NA,NA,NA,NA,NA,NA,NA,NA,NA,NA,NA,NA,NA,NA,NA,NA,NA,NA,NA,NA,NA,NA
"309","Oray-Schrom, Pinar; Phoenix, Carlene; St Martin, Dacelin; Amoateng-Adjepong, Yaw",2003,"Sepsis workup in febrile infants 0-90 days of age with respiratory syncytial virus infection.",0,0,NA,3,0,NA,NA,NA,NA,NA,NA,NA,NA,NA,NA,NA,NA,NA,NA,NA,NA,NA,NA,NA,NA,NA,NA,NA,NA,NA,NA,NA,NA,NA,NA,NA,NA,NA,NA,NA,NA,NA,NA,NA,NA,NA,NA,NA,NA,NA,NA,NA,NA,NA,NA,NA,NA,NA,NA,NA,NA
"310","Orford, Neil R.; Faulkner, Chris; Flintoff, Wendy; Eddey, David; Lamb-Jenkins, Jill; Henry, Margaret; Corke, Charlie; Stow, Peter; Green, David",2008,"Implementation and outcomes of a severe sepsis protocol in an Australian tertiary hospital.",0,0,NA,2,0,NA,NA,NA,NA,NA,NA,NA,NA,NA,NA,NA,NA,NA,NA,NA,NA,NA,NA,NA,NA,NA,NA,NA,NA,NA,NA,NA,NA,NA,NA,NA,NA,NA,NA,NA,NA,NA,NA,NA,NA,NA,NA,NA,NA,NA,NA,NA,NA,NA,NA,NA,NA,NA,NA,NA,NA
"311","Osborn, Tiffany Medlin; Tracy, J. Kathleen; Dunne, James R.; Pasquale, Michael; Napolitano, Lena M.",2004,"Epidemiology of sepsis in patients with traumatic injury.",0,0,NA,5,0,NA,NA,NA,NA,NA,NA,NA,NA,NA,NA,NA,NA,NA,NA,NA,NA,NA,NA,NA,NA,NA,NA,NA,NA,NA,NA,NA,NA,NA,NA,NA,NA,NA,NA,NA,NA,NA,NA,NA,NA,NA,NA,NA,NA,NA,NA,NA,NA,NA,NA,NA,NA,NA,NA,NA,NA
"312","O'Toole, Robert V.; Riche, Kevin; Cannada, Lisa K.; Hennessy, Michael; Sciadini, Marcus F.; Shi, Lewis L.; Woodford, Mathew; Harris, Mitchel B.",2010,"Analysis of postoperative knee sepsis after retrograde nail insertion of open femoral shaft fractures.",0,0,NA,2,0,NA,NA,NA,NA,NA,NA,NA,NA,NA,NA,NA,NA,NA,NA,NA,NA,NA,NA,NA,NA,NA,NA,NA,NA,NA,NA,NA,NA,NA,NA,NA,NA,NA,NA,NA,NA,NA,NA,NA,NA,NA,NA,NA,NA,NA,NA,NA,NA,NA,NA,NA,NA,NA,NA,NA,NA
"313","Padkin, A.; Goldfrad, C.; Brady, A. R.; Young, D.; Black, N.; Rowan, K.",2003,"Epidemiology of severe sepsis occurring in the first 24 hrs in intensive care units in England, Wales, and Northern Ireland",1,1,1,NA,1,"England_Wales_Northern_Ireland","Chart","PROWESS","PROWESS","ICU",91,56673,"<16 years","readmissions",NA,0,1997,NA,NA,NA,NA,NA,NA,NA,NA,NA,NA,NA,NA,NA,NA,NA,NA,NA,NA,NA,NA,NA,NA,NA,NA,NA,NA,NA,NA,NA,NA,NA,NA,51,NA,NA,NA,NA,NA,NA,NA,NA,NA,NA,NA
