"id","author","pub.year","title","inc.abst.ahe","inc.abst.sem","inc.full.read","reason","found.by.ref","country","coding.sys","sepsis.def","org.fail.def","data.source","sample.frac.n.units","stud.pop.size","ex.crit.A","ex.crit.B","ex.crit.C","int.valid","study.year.1","study.year.2","study.year.3","study.year.4","study.year.5","study.year.6","study.year.7","study.year.8","study.year.9","study.year.10","study.year.11","avg.age.1","avg.age.2","avg.age.3","avg.age.4","avg.age.5","avg.age.6","avg.age.7","avg.age.8","avg.age.9","avg.age.10","avg.age.11","incid.1","incid.2","incid.3","incid.4","incid.5","incid.6","incid.7","incid.8","incid.9","incid.10","incid.11","severe.incid.1","severe.incid.2","severe.incid.3","severe.incid.4","severe.incid.5","severe.incid.6","severe.incid.7","severe.incid.8","severe.incid.9","severe.incid.10","severe.incid.11","note"
"1","Abbott, K. C.; Oliver, J. D. 3rd; Hypolite, I.; Lepler, L. L.; Kirk, A. D.; Ko, C. W.; Hawkes, C. A.; Jones, C. A.; Agodoa, L. Y.",2001,"Hospitalizations for bacterial septicemia after renal transplantation in the united states.",0,0,NA,5,0,NA,NA,NA,NA,NA,NA,NA,NA,NA,NA,NA,NA,NA,NA,NA,NA,NA,NA,NA,NA,NA,NA,NA,NA,NA,NA,NA,NA,NA,NA,NA,NA,NA,NA,NA,NA,NA,NA,NA,NA,NA,NA,NA,NA,NA,NA,NA,NA,NA,NA,NA,NA,NA,NA,NA,NA
"2","Abbott, Kevin C.; Napier, Malcolm G.; Agodoa, Lawrence Y. C.",2002,"Hospitalizations for bacterial septicemia in patients with end stage renal disease due to diabetes on the renal transplant waiting list.",0,0,NA,4,0,NA,NA,NA,NA,NA,NA,NA,NA,NA,NA,NA,NA,NA,NA,NA,NA,NA,NA,NA,NA,NA,NA,NA,NA,NA,NA,NA,NA,NA,NA,NA,NA,NA,NA,NA,NA,NA,NA,NA,NA,NA,NA,NA,NA,NA,NA,NA,NA,NA,NA,NA,NA,NA,NA,NA,NA
"3","Abraham, E.; Laterre, P. F.; Garbino, J.; Pingleton, S.; Butler, T.; Dugernier, T.; Margolis, B.; Kudsk, K.; Zimmerli, W.; Anderson, P.; Reynaert, M.; Lew, D.; Lesslauer, W.; Passe, S.; Cooper, P.; Burdeska, A.; Modi, M.; Leighton, A.; Salgo, M.; Van der Auwera, P.",2001,"Lenercept (p55 tumor necrosis factor receptor fusion protein) in severe sepsis and early septic shock: a randomized, double-blind, placebo-controlled, multicenter phase III trial with 1,342 patients.",0,0,NA,2,0,NA,NA,NA,NA,NA,NA,NA,NA,NA,NA,NA,NA,NA,NA,NA,NA,NA,NA,NA,NA,NA,NA,NA,NA,NA,NA,NA,NA,NA,NA,NA,NA,NA,NA,NA,NA,NA,NA,NA,NA,NA,NA,NA,NA,NA,NA,NA,NA,NA,NA,NA,NA,NA,NA,NA,NA
"4","Abraham, E.; Reinhart, K.; Svoboda, P.; Seibert, A.; Olthoff, D.; Dal Nogare, A.; Postier, R.; Hempelmann, G.; Butler, T.; Martin, E.; Zwingelstein, C.; Percell, S.; Shu, V.; Leighton, A.; Creasey, A. A.",2001,"Assessment of the safety of recombinant tissue factor pathway inhibitor in patients with severe sepsis: a multicenter, randomized, placebo-controlled, single-blind, dose escalation study.",0,0,NA,2,0,NA,NA,NA,NA,NA,NA,NA,NA,NA,NA,NA,NA,NA,NA,NA,NA,NA,NA,NA,NA,NA,NA,NA,NA,NA,NA,NA,NA,NA,NA,NA,NA,NA,NA,NA,NA,NA,NA,NA,NA,NA,NA,NA,NA,NA,NA,NA,NA,NA,NA,NA,NA,NA,NA,NA,NA
"5","Abraham, Edward; Laterre, Pierre-Francois; Garg, Rekha; Levy, Howard; Talwar, Deepak; Trzaskoma, Benjamin L.; Francois, Bruno; Guy, Jeffrey S.; Bruckmann, Martina; Rea-Neto, Alvaro; Rossaint, Rolf; Perrotin, Dominique; Sablotzki, Armin; Arkins, Nancy; Utterback, Barbara G.; Macias, William L.",2005,"Drotrecogin alfa (activated) for adults with severe sepsis and a low risk of death.",0,0,NA,2,0,NA,NA,NA,NA,NA,NA,NA,NA,NA,NA,NA,NA,NA,NA,NA,NA,NA,NA,NA,NA,NA,NA,NA,NA,NA,NA,NA,NA,NA,NA,NA,NA,NA,NA,NA,NA,NA,NA,NA,NA,NA,NA,NA,NA,NA,NA,NA,NA,NA,NA,NA,NA,NA,NA,NA,NA
"6","Abu-Osba, Y. K.; Mallouh, A. A.; Hann, R. W.",1989,"Incidence and causes of sepsis in glucose-6-phosphate dehydrogenase-deficient newborn infants.",0,0,NA,3,0,NA,NA,NA,NA,NA,NA,NA,NA,NA,NA,NA,NA,NA,NA,NA,NA,NA,NA,NA,NA,NA,NA,NA,NA,NA,NA,NA,NA,NA,NA,NA,NA,NA,NA,NA,NA,NA,NA,NA,NA,NA,NA,NA,NA,NA,NA,NA,NA,NA,NA,NA,NA,NA,NA,NA,NA
"7","Abu-Sharar, Ziad; Robinson, Ashley; Lavoie, Pascal M.",2010,"Incidence of septicemia immediately after elective gastrointestinal contrast procedures in infants: a cohort study.",0,0,NA,3,0,NA,NA,NA,NA,NA,NA,NA,NA,NA,NA,NA,NA,NA,NA,NA,NA,NA,NA,NA,NA,NA,NA,NA,NA,NA,NA,NA,NA,NA,NA,NA,NA,NA,NA,NA,NA,NA,NA,NA,NA,NA,NA,NA,NA,NA,NA,NA,NA,NA,NA,NA,NA,NA,NA,NA,NA
"8","Acosta, Colleen D.; Knight, Marian; Lee, Henry C.; Kurinczuk, Jennifer J.; Gould, Jeffrey B.; Lyndon, Audrey",2013,"The continuum of maternal sepsis severity: incidence and risk factors in a population-based cohort study.",0,0,NA,6,0,NA,NA,NA,NA,NA,NA,NA,NA,NA,NA,NA,NA,NA,NA,NA,NA,NA,NA,NA,NA,NA,NA,NA,NA,NA,NA,NA,NA,NA,NA,NA,NA,NA,NA,NA,NA,NA,NA,NA,NA,NA,NA,NA,NA,NA,NA,NA,NA,NA,NA,NA,NA,NA,NA,NA,NA
"9","Adler, Amos; Gottesman, Giora; Dolfin, Tzipora; Arnon, Shmuel; Regev, Rivka; Bauer, Sophia; Litmanovitz, Ita",2005,"Bacillus species sepsis in the neonatal intensive care unit.",0,0,NA,2,0,NA,NA,NA,NA,NA,NA,NA,NA,NA,NA,NA,NA,NA,NA,NA,NA,NA,NA,NA,NA,NA,NA,NA,NA,NA,NA,NA,NA,NA,NA,NA,NA,NA,NA,NA,NA,NA,NA,NA,NA,NA,NA,NA,NA,NA,NA,NA,NA,NA,NA,NA,NA,NA,NA,NA,NA
"10","Afroza, S.",2006,"Neonatal sepsis-- a global problem: an overview.",0,0,NA,1,0,NA,NA,NA,NA,NA,NA,NA,NA,NA,NA,NA,NA,NA,NA,NA,NA,NA,NA,NA,NA,NA,NA,NA,NA,NA,NA,NA,NA,NA,NA,NA,NA,NA,NA,NA,NA,NA,NA,NA,NA,NA,NA,NA,NA,NA,NA,NA,NA,NA,NA,NA,NA,NA,NA,NA,NA
"11","Agnihotri, Nalini; Kaistha, Neelam; Gupta, Varsha",2004,"Antimicrobial susceptibility of isolates from neonatal septicemia.",0,0,NA,2,0,NA,NA,NA,NA,NA,NA,NA,NA,NA,NA,NA,NA,NA,NA,NA,NA,NA,NA,NA,NA,NA,NA,NA,NA,NA,NA,NA,NA,NA,NA,NA,NA,NA,NA,NA,NA,NA,NA,NA,NA,NA,NA,NA,NA,NA,NA,NA,NA,NA,NA,NA,NA,NA,NA,NA,NA
"12","Ahmed, Wasim; Memon, Javed I.; Rehmani, Rifat; Al Juhaiman, Abdulmajeed",2014,"Outcome of patients with acute kidney injury in severe sepsis and septic shock treated with early goal-directed therapy in an intensive care unit.",0,0,NA,2,0,NA,NA,NA,NA,NA,NA,NA,NA,NA,NA,NA,NA,NA,NA,NA,NA,NA,NA,NA,NA,NA,NA,NA,NA,NA,NA,NA,NA,NA,NA,NA,NA,NA,NA,NA,NA,NA,NA,NA,NA,NA,NA,NA,NA,NA,NA,NA,NA,NA,NA,NA,NA,NA,NA,NA,NA
"13","Alam, Muhammad Matloob; Saleem, Ali Faisal; Shaikh, Abdul Sattar; Munir, Owais; Qadir, Maqbool",2014,"Neonatal sepsis following prolonged rupture of membranes in a tertiary care hospital in Karachi, Pakistan.",0,0,NA,3,0,NA,NA,NA,NA,NA,NA,NA,NA,NA,NA,NA,NA,NA,NA,NA,NA,NA,NA,NA,NA,NA,NA,NA,NA,NA,NA,NA,NA,NA,NA,NA,NA,NA,NA,NA,NA,NA,NA,NA,NA,NA,NA,NA,NA,NA,NA,NA,NA,NA,NA,NA,NA,NA,NA,NA,NA
"14","Alarcon, Ana; Pena, Pilar; Salas, Sofia; Sancha, Marta; Omenaca, Felix",2004,"Neonatal early onset Escherichia coli sepsis: trends in incidence and antimicrobial resistance in the era of intrapartum antimicrobial prophylaxis.",0,0,NA,3,0,NA,NA,NA,NA,NA,NA,NA,NA,NA,NA,NA,NA,NA,NA,NA,NA,NA,NA,NA,NA,NA,NA,NA,NA,NA,NA,NA,NA,NA,NA,NA,NA,NA,NA,NA,NA,NA,NA,NA,NA,NA,NA,NA,NA,NA,NA,NA,NA,NA,NA,NA,NA,NA,NA,NA,NA
"15","Alberti, Corinne; Brun-Buisson, Christian; Burchardi, Hilmar; Martin, Claudio; Goodman, Sergey; Artigas, Antonio; Sicignano, Alberto; Palazzo, Mark; Moreno, Rui; Boulme, Ronan; Lepage, Eric; Le Gall, Roger",2002,"Epidemiology of sepsis and infection in ICU patients from an international multicentre cohort study.",0,0,NA,15,0,NA,NA,NA,NA,NA,NA,NA,NA,NA,NA,NA,NA,NA,NA,NA,NA,NA,NA,NA,NA,NA,NA,NA,NA,NA,NA,NA,NA,NA,NA,NA,NA,NA,NA,NA,NA,NA,NA,NA,NA,NA,NA,NA,NA,NA,NA,NA,NA,NA,NA,NA,NA,NA,NA,NA,NA
"16","Alberti, Corinne; Brun-Buisson, Christian; Chevret, Sylvie; Antonelli, Massimo; Goodman, Sergey V.; Martin, Claudio; Moreno, Rui; Ochagavia, Ana R.; Palazzo, Mark; Werdan, Karl; Le Gall, Jean Roger",2005,"Systemic inflammatory response and progression to severe sepsis in critically ill infected patients.",0,0,NA,15,0,NA,NA,NA,NA,NA,NA,NA,NA,NA,NA,NA,NA,NA,NA,NA,NA,NA,NA,NA,NA,NA,NA,NA,NA,NA,NA,NA,NA,NA,NA,NA,NA,NA,NA,NA,NA,NA,NA,NA,NA,NA,NA,NA,NA,NA,NA,NA,NA,NA,NA,NA,NA,NA,NA,NA,NA
"17","Aledo, A.; Heller, G.; Ren, L.; Gardner, S.; Dunkel, I.; McKay, S. W.; Flombaum, C.; Brown, A. E.",1998,"Septicemia and septic shock in pediatric patients: 140 consecutive cases on a pediatric hematology-oncology service.",0,0,NA,7,0,NA,NA,NA,NA,NA,NA,NA,NA,NA,NA,NA,NA,NA,NA,NA,NA,NA,NA,NA,NA,NA,NA,NA,NA,NA,NA,NA,NA,NA,NA,NA,NA,NA,NA,NA,NA,NA,NA,NA,NA,NA,NA,NA,NA,NA,NA,NA,NA,NA,NA,NA,NA,NA,NA,NA,NA
"18","Almeida, Luiz Mauricio Costa; Diniz, Michelle dos Santos; Diniz, Lorena dos Santos; Machado-Pinto, Jackson; Silva, Francisco Chagas Lima",2013,"Comparative study of the prevalence of sepsis in patients admitted to dermatology and internal medicine wards.",0,0,NA,2,0,NA,NA,NA,NA,NA,NA,NA,NA,NA,NA,NA,NA,NA,NA,NA,NA,NA,NA,NA,NA,NA,NA,NA,NA,NA,NA,NA,NA,NA,NA,NA,NA,NA,NA,NA,NA,NA,NA,NA,NA,NA,NA,NA,NA,NA,NA,NA,NA,NA,NA,NA,NA,NA,NA,NA,NA
"19","Almog, Yaniv",2003,"Statins, inflammation, and sepsis: hypothesis.",0,0,NA,0,0,NA,NA,NA,NA,NA,NA,NA,NA,NA,NA,NA,NA,NA,NA,NA,NA,NA,NA,NA,NA,NA,NA,NA,NA,NA,NA,NA,NA,NA,NA,NA,NA,NA,NA,NA,NA,NA,NA,NA,NA,NA,NA,NA,NA,NA,NA,NA,NA,NA,NA,NA,NA,NA,NA,NA,NA
"20","Al-Taiar, Abdullah; Hammoud, Majeda S.; Thalib, Lukman; Isaacs, David",2011,"Pattern and etiology of culture-proven early-onset neonatal sepsis: a five-year prospective study.",0,0,NA,3,0,NA,NA,NA,NA,NA,NA,NA,NA,NA,NA,NA,NA,NA,NA,NA,NA,NA,NA,NA,NA,NA,NA,NA,NA,NA,NA,NA,NA,NA,NA,NA,NA,NA,NA,NA,NA,NA,NA,NA,NA,NA,NA,NA,NA,NA,NA,NA,NA,NA,NA,NA,NA,NA,NA,NA,NA
"21","Amrein, Karin; Zajic, Paul; Schnedl, Christian; Waltensdorfer, Andreas; Fruhwald, Sonja; Holl, Alexander; Purkart, Tadeja; Wunsch, Gerit; Valentin, Thomas; Grisold, Andrea; Stojakovic, Tatjana; Amrein, Steven; Pieber, Thomas R.; Dobnig, Harald",2014,"Vitamin D status and its association with season, hospital and sepsis mortality in critical illness.",0,0,NA,2,0,NA,NA,NA,NA,NA,NA,NA,NA,NA,NA,NA,NA,NA,NA,NA,NA,NA,NA,NA,NA,NA,NA,NA,NA,NA,NA,NA,NA,NA,NA,NA,NA,NA,NA,NA,NA,NA,NA,NA,NA,NA,NA,NA,NA,NA,NA,NA,NA,NA,NA,NA,NA,NA,NA,NA,NA
"22","Angus, D. C.; Linde-Zwirble, W. T.; Lidicker, J.; Clermont, G.; Carcillo, J.; Pinsky, M. R.",2001,"Epidemiology of severe sepsis in the United States: analysis of incidence, outcome, and associated costs of care.",1,1,1,NA,0,"USA","ICD9",NA,NA,"Constructed database",0.25,6621559,NA,NA,NA,1,1995,NA,NA,NA,NA,NA,NA,NA,NA,NA,NA,63.8,NA,NA,NA,NA,NA,NA,NA,NA,NA,NA,NA,NA,NA,NA,NA,NA,NA,NA,NA,NA,NA,300,NA,NA,NA,NA,NA,NA,NA,NA,NA,NA,NA
"23","Angus, D. C.; Wax, R. S.",2001,"Epidemiology of sepsis: an update.",0,0,NA,1,0,NA,NA,NA,NA,NA,NA,NA,NA,NA,NA,NA,NA,NA,NA,NA,NA,NA,NA,NA,NA,NA,NA,NA,NA,NA,NA,NA,NA,NA,NA,NA,NA,NA,NA,NA,NA,NA,NA,NA,NA,NA,NA,NA,NA,NA,NA,NA,NA,NA,NA,NA,NA,NA,NA,NA,NA
"24","Angus, Derek C.; Pereira, Carlos Alberto Pires; Silva, Eliezer",2006,"Epidemiology of severe sepsis around the world.",0,0,NA,1,0,NA,NA,NA,NA,NA,NA,NA,NA,NA,NA,NA,NA,NA,NA,NA,NA,NA,NA,NA,NA,NA,NA,NA,NA,NA,NA,NA,NA,NA,NA,NA,NA,NA,NA,NA,NA,NA,NA,NA,NA,NA,NA,NA,NA,NA,NA,NA,NA,NA,NA,NA,NA,NA,NA,NA,NA
"25","Anunnatsiri, Siriluck; Towiwat, Patapong; Chaimanee, Prajuab",2012,"Risk factors and clinical outcomes of extended spectrum beta-lactamase (ESBL)-producing Escherichia coli septicemia at Srinagarind University Hospital,  Thailand.",0,0,NA,9,0,NA,NA,NA,NA,NA,NA,NA,NA,NA,NA,NA,NA,NA,NA,NA,NA,NA,NA,NA,NA,NA,NA,NA,NA,NA,NA,NA,NA,NA,NA,NA,NA,NA,NA,NA,NA,NA,NA,NA,NA,NA,NA,NA,NA,NA,NA,NA,NA,NA,NA,NA,NA,NA,NA,NA,NA
"26","Araujo, Helton Fernandes; Campos, Patricia Cota; Camargo, Dhian Renato Almeida; Pereira, Filippe Nonato Roberto; Samuel, Michelle Lara; Oliveira, Marluce Aparecida Assuncao; Fortes-Dias, Consuelo Latorre; Leclercq, Sophie Yvette",2012,"Immune response and protective efficacy of S9 ribosomal protein of Streptococcus  pneumoniae in a model of sepsis.",0,0,NA,2,0,NA,NA,NA,NA,NA,NA,NA,NA,NA,NA,NA,NA,NA,NA,NA,NA,NA,NA,NA,NA,NA,NA,NA,NA,NA,NA,NA,NA,NA,NA,NA,NA,NA,NA,NA,NA,NA,NA,NA,NA,NA,NA,NA,NA,NA,NA,NA,NA,NA,NA,NA,NA,NA,NA,NA,NA
"27","ARISE;  ANZICS APD",2007,"The outcome of patients with sepsis and septic shock presenting to emergency departments in Australia and New Zealand.",0,0,NA,1,0,NA,NA,NA,NA,NA,NA,NA,NA,NA,NA,NA,NA,NA,NA,NA,NA,NA,NA,NA,NA,NA,NA,NA,NA,NA,NA,NA,NA,NA,NA,NA,NA,NA,NA,NA,NA,NA,NA,NA,NA,NA,NA,NA,NA,NA,NA,NA,NA,NA,NA,NA,NA,NA,NA,NA,NA
"28","Arnold, Ryan C.; Sherwin, Robert; Shapiro, Nathan I.; O'Connor, Jennifer L.; Glaspey, Lindsey; Singh, Sam; Medado, Patrick; Trzeciak, Stephen; Jones, Alan E.",2013,"Multicenter observational study of the development of progressive organ dysfunction and therapeutic interventions in normotensive sepsis patients in the  emergency department.",0,0,NA,2,0,NA,NA,NA,NA,NA,NA,NA,NA,NA,NA,NA,NA,NA,NA,NA,NA,NA,NA,NA,NA,NA,NA,NA,NA,NA,NA,NA,NA,NA,NA,NA,NA,NA,NA,NA,NA,NA,NA,NA,NA,NA,NA,NA,NA,NA,NA,NA,NA,NA,NA,NA,NA,NA,NA,NA,NA
"29","Arnow, P. M.; Quimosing, E. M.; Beach, M.",1993,"Consequences of intravascular catheter sepsis.",0,0,NA,2,0,NA,NA,NA,NA,NA,NA,NA,NA,NA,NA,NA,NA,NA,NA,NA,NA,NA,NA,NA,NA,NA,NA,NA,NA,NA,NA,NA,NA,NA,NA,NA,NA,NA,NA,NA,NA,NA,NA,NA,NA,NA,NA,NA,NA,NA,NA,NA,NA,NA,NA,NA,NA,NA,NA,NA,NA
"30","Arons, M. M.; Wheeler, A. P.; Bernard, G. R.; Christman, B. W.; Russell, J. A.; Schein, R.; Summer, W. R.; Steinberg, K. P.; Fulkerson, W.; Wright, P.; Dupont, W. D.; Swindell, B. B.",1999,"Effects of ibuprofen on the physiology and survival of hypothermic sepsis. Ibuprofen in Sepsis Study Group.",0,0,NA,2,0,NA,NA,NA,NA,NA,NA,NA,NA,NA,NA,NA,NA,NA,NA,NA,NA,NA,NA,NA,NA,NA,NA,NA,NA,NA,NA,NA,NA,NA,NA,NA,NA,NA,NA,NA,NA,NA,NA,NA,NA,NA,NA,NA,NA,NA,NA,NA,NA,NA,NA,NA,NA,NA,NA,NA,NA
"31","Ascher, S. B.; Smith, P. B.; Clark, R. H.; Cohen-Wolkowiez, M.; Li, J. S.; Watt, K.; Jacqz-Aigrain, E.; Kaguelidou, F.; Manzoni, P.; Benjamin, D. K. Jr",2012,"Sepsis in young infants with congenital heart disease.",0,0,NA,3,0,NA,NA,NA,NA,NA,NA,NA,NA,NA,NA,NA,NA,NA,NA,NA,NA,NA,NA,NA,NA,NA,NA,NA,NA,NA,NA,NA,NA,NA,NA,NA,NA,NA,NA,NA,NA,NA,NA,NA,NA,NA,NA,NA,NA,NA,NA,NA,NA,NA,NA,NA,NA,NA,NA,NA,NA
"32","Awad, H.; Mokhtar, H.; Imam, S. S.; Gad, G. I.; Hafez, H.; Aboushady, N.",2010,"Comparison between killed and living probiotic usage versus placebo for the prevention of necrotizing enterocolitis and sepsis in neonates.",0,0,NA,3,0,NA,NA,NA,NA,NA,NA,NA,NA,NA,NA,NA,NA,NA,NA,NA,NA,NA,NA,NA,NA,NA,NA,NA,NA,NA,NA,NA,NA,NA,NA,NA,NA,NA,NA,NA,NA,NA,NA,NA,NA,NA,NA,NA,NA,NA,NA,NA,NA,NA,NA,NA,NA,NA,NA,NA,NA
"33","Axtelle, Tim; Pribble, John",2003,"An overview of clinical studies in healthy subjects and patients with severe sepsis with IC14, a CD14-specific chimeric monoclonal antibody.",0,0,NA,1,0,NA,NA,NA,NA,NA,NA,NA,NA,NA,NA,NA,NA,NA,NA,NA,NA,NA,NA,NA,NA,NA,NA,NA,NA,NA,NA,NA,NA,NA,NA,NA,NA,NA,NA,NA,NA,NA,NA,NA,NA,NA,NA,NA,NA,NA,NA,NA,NA,NA,NA,NA,NA,NA,NA,NA,NA
"34","Ayala-Ramirez, O. H.; Dominguez-Berjon, M. F.; Esteban-Vasallo, M. D.",2014,"Trends in hospitalizations of patients with sepsis and factors associated with inpatient mortality in the Region of Madrid, 2003-2011.",1,0,0,18,0,NA,NA,NA,NA,NA,NA,NA,NA,NA,NA,NA,NA,NA,NA,NA,NA,NA,NA,NA,NA,NA,NA,NA,NA,NA,NA,NA,NA,NA,NA,NA,NA,NA,NA,NA,NA,NA,NA,NA,NA,NA,NA,NA,NA,NA,NA,NA,NA,NA,NA,NA,NA,NA,NA,NA,NA
"35","Baghel, Kavita; Srivastava, Rajeshwar Nath; Chandra, Abhijit; Raj, Saloni; Goel, Sudhir K.; Pant, Aditya Bhusan; Agrawal, Jyotsna",2014,"Tumor necrosis factor-beta Nco1 polymorphism and susceptibility to sepsis following major elective surgery.",0,0,NA,2,0,NA,NA,NA,NA,NA,NA,NA,NA,NA,NA,NA,NA,NA,NA,NA,NA,NA,NA,NA,NA,NA,NA,NA,NA,NA,NA,NA,NA,NA,NA,NA,NA,NA,NA,NA,NA,NA,NA,NA,NA,NA,NA,NA,NA,NA,NA,NA,NA,NA,NA,NA,NA,NA,NA,NA,NA
"36","Bagshaw, Sean M.; George, Carol; Bellomo, Rinaldo",2008,"Early acute kidney injury and sepsis: a multicentre evaluation.",0,0,NA,2,0,NA,NA,NA,NA,NA,NA,NA,NA,NA,NA,NA,NA,NA,NA,NA,NA,NA,NA,NA,NA,NA,NA,NA,NA,NA,NA,NA,NA,NA,NA,NA,NA,NA,NA,NA,NA,NA,NA,NA,NA,NA,NA,NA,NA,NA,NA,NA,NA,NA,NA,NA,NA,NA,NA,NA,NA
"37","Baharoon, Salim; Al-Jahdali, Hamdan; Al Hashmi, Jamal; Memish, Ziad A.; Ahmed, Qanta A.",2009,"Severe sepsis and septic shock at the Hajj: etiologies and outcomes.",0,0,NA,2,0,NA,NA,NA,NA,NA,NA,NA,NA,NA,NA,NA,NA,NA,NA,NA,NA,NA,NA,NA,NA,NA,NA,NA,NA,NA,NA,NA,NA,NA,NA,NA,NA,NA,NA,NA,NA,NA,NA,NA,NA,NA,NA,NA,NA,NA,NA,NA,NA,NA,NA,NA,NA,NA,NA,NA,NA
"38","Bako, Babagana; Audu, Bala M.; Lawan, Zara Mairam; Umar, Jidda Baba",2012,"Risk factors and microbial isolates of puerperal sepsis at the University of Maiduguri Teaching Hospital, Maiduguri, North-eastern Nigeria.",0,0,NA,2,0,NA,NA,NA,NA,NA,NA,NA,NA,NA,NA,NA,NA,NA,NA,NA,NA,NA,NA,NA,NA,NA,NA,NA,NA,NA,NA,NA,NA,NA,NA,NA,NA,NA,NA,NA,NA,NA,NA,NA,NA,NA,NA,NA,NA,NA,NA,NA,NA,NA,NA,NA,NA,NA,NA,NA,NA
"39","Balk, Robert A.",2004,"Optimum treatment of severe sepsis and septic shock: evidence in support of the recommendations.",0,0,NA,1,0,NA,NA,NA,NA,NA,NA,NA,NA,NA,NA,NA,NA,NA,NA,NA,NA,NA,NA,NA,NA,NA,NA,NA,NA,NA,NA,NA,NA,NA,NA,NA,NA,NA,NA,NA,NA,NA,NA,NA,NA,NA,NA,NA,NA,NA,NA,NA,NA,NA,NA,NA,NA,NA,NA,NA,NA
"40","Ballester, Juan Carlo Andreus; Ballester, Ferran; Gonzalez Sanchez, Antonio; Almela Quilis, Amadeo; Colomer Rubio, Enrique; Penarroja Otero, Carlos",2008,"Epidemiology of sepsis in the Valencian Community (Spain), 1995-2004.",1,1,0,18,0,"Spain","ICD9",NA,NA,"Constructed database",1,NA,NA,NA,NA,0,1995,2004,NA,NA,NA,NA,NA,NA,NA,NA,NA,NA,NA,NA,NA,NA,NA,NA,NA,NA,NA,NA,NA,NA,NA,NA,NA,NA,NA,NA,NA,NA,NA,24,52,NA,NA,NA,NA,NA,NA,NA,NA,NA,"Sepsis incidence in general population reportet in discussion but there is not mentioned in neither method or results section leading to concerns about computations."
"41","Barker, G. J.; Call, S. K.; Gamis, A. S.",1995,"Oral care with vancomycin paste for reduction in incidence of alpha-hemolytic streptococcal sepsis.",0,0,NA,2,0,NA,NA,NA,NA,NA,NA,NA,NA,NA,NA,NA,NA,NA,NA,NA,NA,NA,NA,NA,NA,NA,NA,NA,NA,NA,NA,NA,NA,NA,NA,NA,NA,NA,NA,NA,NA,NA,NA,NA,NA,NA,NA,NA,NA,NA,NA,NA,NA,NA,NA,NA,NA,NA,NA,NA,NA
"42","Barnato, Amber E.; Alexander, Sherri L.; Linde-Zwirble, Walter T.; Angus, Derek C.",2008,"Racial variation in the incidence, care, and outcomes of severe sepsis: analysis  of population, patient, and hospital characteristics.",1,0,0,2,0,NA,NA,NA,NA,NA,NA,NA,NA,NA,NA,NA,NA,NA,NA,NA,NA,NA,NA,NA,NA,NA,NA,NA,NA,NA,NA,NA,NA,NA,NA,NA,NA,NA,NA,NA,NA,NA,NA,NA,NA,NA,NA,NA,NA,NA,NA,NA,NA,NA,NA,NA,NA,NA,NA,NA,NA
"43","Bartlett, J. G.; Onderdonk, A. B.; Louie, T.; Kasper, D. L.; Gorbach, S. L.",1978,"A review. Lessons from an animal model of intra-abdominal sepsis.",0,0,NA,1,0,NA,NA,NA,NA,NA,NA,NA,NA,NA,NA,NA,NA,NA,NA,NA,NA,NA,NA,NA,NA,NA,NA,NA,NA,NA,NA,NA,NA,NA,NA,NA,NA,NA,NA,NA,NA,NA,NA,NA,NA,NA,NA,NA,NA,NA,NA,NA,NA,NA,NA,NA,NA,NA,NA,NA,NA
"44","Barton, Phil; Kalil, Andre C.; Nadel, Simon; Goldstein, Brahm; Okhuysen-Cawley, Regina; Brilli, Richard J.; Takano, Jeanne S.; Martin, Lynn D.; Quint, Peter; Yeh, Timothy S.; Dalton, Heidi J.; Gessouron, Morris R.; Brown, Kellie E.; Betts, Helen; Levin, Michael; Macias, William L.; Small, David S.; Wyss, Virginia L.; Bates, Becky M.; Utterback, Barbara G.; Giroir, Brett P.",2004,"Safety, pharmacokinetics, and pharmacodynamics of drotrecogin alfa (activated) in children with severe sepsis.",0,0,NA,2,0,NA,NA,NA,NA,NA,NA,NA,NA,NA,NA,NA,NA,NA,NA,NA,NA,NA,NA,NA,NA,NA,NA,NA,NA,NA,NA,NA,NA,NA,NA,NA,NA,NA,NA,NA,NA,NA,NA,NA,NA,NA,NA,NA,NA,NA,NA,NA,NA,NA,NA,NA,NA,NA,NA,NA,NA
"45","Behrman, Stephen W.; Zarzaur, Ben L.",2008,"Intra-abdominal sepsis following pancreatic resection: incidence, risk factors, diagnosis, microbiology, management, and outcome.",0,0,NA,5,0,NA,NA,NA,NA,NA,NA,NA,NA,NA,NA,NA,NA,NA,NA,NA,NA,NA,NA,NA,NA,NA,NA,NA,NA,NA,NA,NA,NA,NA,NA,NA,NA,NA,NA,NA,NA,NA,NA,NA,NA,NA,NA,NA,NA,NA,NA,NA,NA,NA,NA,NA,NA,NA,NA,NA,NA
"46","Bell, Y.; Barton, M.; Thame, M.; Nicholson, A.; Trotman, H.",2005,"Neonatal sepsis in Jamaican neonates.",0,0,NA,3,0,NA,NA,NA,NA,NA,NA,NA,NA,NA,NA,NA,NA,NA,NA,NA,NA,NA,NA,NA,NA,NA,NA,NA,NA,NA,NA,NA,NA,NA,NA,NA,NA,NA,NA,NA,NA,NA,NA,NA,NA,NA,NA,NA,NA,NA,NA,NA,NA,NA,NA,NA,NA,NA,NA,NA,NA
"47","Bendel, Stepani; Karlsson, Sari; Pettila, Ville; Loisa, Pekka; Varpula, Marjut; Ruokonen, Esko",2008,"Free cortisol in sepsis and septic shock.",0,0,NA,2,0,NA,NA,NA,NA,NA,NA,NA,NA,NA,NA,NA,NA,NA,NA,NA,NA,NA,NA,NA,NA,NA,NA,NA,NA,NA,NA,NA,NA,NA,NA,NA,NA,NA,NA,NA,NA,NA,NA,NA,NA,NA,NA,NA,NA,NA,NA,NA,NA,NA,NA,NA,NA,NA,NA,NA,NA
"48","Bennet, R.; Bergdahl, S.; Eriksson, M.; Zetterstrom, R.",1989,"The outcome of neonatal septicemia during fifteen years.",0,0,NA,3,0,NA,NA,NA,NA,NA,NA,NA,NA,NA,NA,NA,NA,NA,NA,NA,NA,NA,NA,NA,NA,NA,NA,NA,NA,NA,NA,NA,NA,NA,NA,NA,NA,NA,NA,NA,NA,NA,NA,NA,NA,NA,NA,NA,NA,NA,NA,NA,NA,NA,NA,NA,NA,NA,NA,NA,NA
"49","Bennet, R.; Eriksson, M.; Melen, B.; Zetterstrom, R.",1985,"Changes in the incidence and spectrum of neonatal septicemia during a fifteen-year period.",0,0,NA,3,0,NA,NA,NA,NA,NA,NA,NA,NA,NA,NA,NA,NA,NA,NA,NA,NA,NA,NA,NA,NA,NA,NA,NA,NA,NA,NA,NA,NA,NA,NA,NA,NA,NA,NA,NA,NA,NA,NA,NA,NA,NA,NA,NA,NA,NA,NA,NA,NA,NA,NA,NA,NA,NA,NA,NA,NA
"50","Bennet, R.; Eriksson, M.; Zetterstrom, R.",1981,"Increasing incidence of neonatal septicemia: causative organism and predisposing  risk factors.",0,0,NA,3,0,NA,NA,NA,NA,NA,NA,NA,NA,NA,NA,NA,NA,NA,NA,NA,NA,NA,NA,NA,NA,NA,NA,NA,NA,NA,NA,NA,NA,NA,NA,NA,NA,NA,NA,NA,NA,NA,NA,NA,NA,NA,NA,NA,NA,NA,NA,NA,NA,NA,NA,NA,NA,NA,NA,NA,NA
"51","Berger, Benjamin; Gumbinger, Christoph; Steiner, Thorsten; Sykora, Marek",2014,"Epidemiologic features, risk factors, and outcome of sepsis in stroke patients treated on a neurologic intensive care unit.",0,0,NA,5,0,NA,NA,NA,NA,NA,NA,NA,NA,NA,NA,NA,NA,NA,NA,NA,NA,NA,NA,NA,NA,NA,NA,NA,NA,NA,NA,NA,NA,NA,NA,NA,NA,NA,NA,NA,NA,NA,NA,NA,NA,NA,NA,NA,NA,NA,NA,NA,NA,NA,NA,NA,NA,NA,NA,NA,NA
"52","Bernard, Gordon R.; Francois, Bruno; Mira, Jean-Paul; Vincent, Jean-Louis; Dellinger, R. Phillip; Russell, James A.; Larosa, Steven P.; Laterre, Pierre-Francois; Levy, Mitchell M.; Dankner, Wayne; Schmitt, Nicola; Lindemann, Justin; Wittebole, Xavier",2014,"Evaluating the efficacy and safety of two doses of the polyclonal anti-tumor necrosis factor-alpha fragment antibody AZD9773 in adult patients with severe sepsis and/or septic shock: randomized, double-blind, placebo-controlled phase IIb study*.",0,0,NA,2,0,NA,NA,NA,NA,NA,NA,NA,NA,NA,NA,NA,NA,NA,NA,NA,NA,NA,NA,NA,NA,NA,NA,NA,NA,NA,NA,NA,NA,NA,NA,NA,NA,NA,NA,NA,NA,NA,NA,NA,NA,NA,NA,NA,NA,NA,NA,NA,NA,NA,NA,NA,NA,NA,NA,NA,NA
"53","Bernard, G. R.; Wheeler, A. P.; Russell, J. A.; Schein, R.; Summer, W. R.; Steinberg, K. P.; Fulkerson, W. J.; Wright, P. E.; Christman, B. W.; Dupont, W. D.; Higgins, S. B.; Swindell, B. B.",1997,"The effects of ibuprofen on the physiology and survival of patients with sepsis.  The Ibuprofen in Sepsis Study Group.",0,0,NA,2,0,NA,NA,NA,NA,NA,NA,NA,NA,NA,NA,NA,NA,NA,NA,NA,NA,NA,NA,NA,NA,NA,NA,NA,NA,NA,NA,NA,NA,NA,NA,NA,NA,NA,NA,NA,NA,NA,NA,NA,NA,NA,NA,NA,NA,NA,NA,NA,NA,NA,NA,NA,NA,NA,NA,NA,NA
"54","Bersani, I.; Speer, C. P.",2012,"Nosocomial sepsis in neonatal intensive care: inevitable or preventable?",0,0,NA,1,0,NA,NA,NA,NA,NA,NA,NA,NA,NA,NA,NA,NA,NA,NA,NA,NA,NA,NA,NA,NA,NA,NA,NA,NA,NA,NA,NA,NA,NA,NA,NA,NA,NA,NA,NA,NA,NA,NA,NA,NA,NA,NA,NA,NA,NA,NA,NA,NA,NA,NA,NA,NA,NA,NA,NA,NA
"55","Bishay, Mark; Retrosi, Giuseppe; Horn, Venetia; Cloutman-Green, Elaine; Harris, Kathryn; De Coppi, Paolo; Klein, Nigel; Eaton, Simon; Pierro, Agostino",2011,"Chlorhexidine antisepsis significantly reduces the incidence of sepsis and septicemia during parenteral nutrition in surgical infants.",0,0,NA,2,0,NA,NA,NA,NA,NA,NA,NA,NA,NA,NA,NA,NA,NA,NA,NA,NA,NA,NA,NA,NA,NA,NA,NA,NA,NA,NA,NA,NA,NA,NA,NA,NA,NA,NA,NA,NA,NA,NA,NA,NA,NA,NA,NA,NA,NA,NA,NA,NA,NA,NA,NA,NA,NA,NA,NA,NA
"56","Blanco, Jesus; Muriel-Bombin, Arturo; Sagredo, Victor; Taboada, Francisco; Gandia, Francisco; Tamayo, Luis; Collado, Javier; Garcia-Labattut, Angel; Carriedo, Demetrio; Valledor, Manuel; De Frutos, Martin; Lopez, Maria-Jesus; Caballero, Ana; Guerra, Jose; Alvarez, Braulio; Mayo, Agustin; Villar, Jesus",2008,"Incidence, organ dysfunction and mortality in severe sepsis: a Spanish multicentre study.",1,1,1,NA,0,"Spain","Chart","Bone crit.","PROWESS","ICU",11,2619,"<18 years","heart disease","cardiac arrhythmia",NA,2002,NA,NA,NA,NA,NA,NA,NA,NA,NA,NA,68,NA,NA,NA,NA,NA,NA,NA,NA,NA,NA,NA,NA,NA,NA,NA,NA,NA,NA,NA,NA,NA,25,NA,NA,NA,NA,NA,NA,NA,NA,NA,NA,NA
"57","Blot, S.; Charles, P. E.",2013,"Fungal sepsis in the ICU: are we doing better? Trends in incidence, diagnosis, and outcome.",0,0,NA,1,0,NA,NA,NA,NA,NA,NA,NA,NA,NA,NA,NA,NA,NA,NA,NA,NA,NA,NA,NA,NA,NA,NA,NA,NA,NA,NA,NA,NA,NA,NA,NA,NA,NA,NA,NA,NA,NA,NA,NA,NA,NA,NA,NA,NA,NA,NA,NA,NA,NA,NA,NA,NA,NA,NA,NA,NA
"58","Boghossian, Nansi S.; Page, Grier P.; Bell, Edward F.; Stoll, Barbara J.; Murray, Jeffrey C.; Cotten, C. Michael; Shankaran, Seetha; Walsh, Michele C.; Laptook, Abbot R.; Newman, Nancy S.; Hale, Ellen C.; McDonald, Scott A.; Das, Abhik; Higgins, Rosemary D.",2013,"Late-onset sepsis in very low birth weight infants from singleton and multiple-gestation births.",0,0,NA,3,0,NA,NA,NA,NA,NA,NA,NA,NA,NA,NA,NA,NA,NA,NA,NA,NA,NA,NA,NA,NA,NA,NA,NA,NA,NA,NA,NA,NA,NA,NA,NA,NA,NA,NA,NA,NA,NA,NA,NA,NA,NA,NA,NA,NA,NA,NA,NA,NA,NA,NA,NA,NA,NA,NA,NA,NA
"59","Bone, R. C.; Balk, R. A.; Cerra, F. B.; Dellinger, R. P.; Fein, A. M.; Knaus, W. A.; Schein, R. M.; Sibbald, W. J.; Committee, ACCP/SCCM Consensus Conference",1992,"Definitions for sepsis and organ failure and guidelines for the use of innovative therapies in sepsis.",NA,NA,NA,NA,NA,NA,NA,NA,NA,NA,NA,NA,NA,NA,NA,NA,NA,NA,NA,NA,NA,NA,NA,NA,NA,NA,NA,NA,NA,NA,NA,NA,NA,NA,NA,NA,NA,NA,NA,NA,NA,NA,NA,NA,NA,NA,NA,NA,NA,NA,NA,NA,NA,NA,NA,NA,NA,NA,NA,NA,NA
"60","Bone, R. C.",1991,"Sepsis, the sepsis syndrome, multi-organ failure: a plea for comparable definitions",NA,NA,NA,NA,NA,NA,NA,NA,NA,NA,NA,NA,NA,NA,NA,NA,NA,NA,NA,NA,NA,NA,NA,NA,NA,NA,NA,NA,NA,NA,NA,NA,NA,NA,NA,NA,NA,NA,NA,NA,NA,NA,NA,NA,NA,NA,NA,NA,NA,NA,NA,NA,NA,NA,NA,NA,NA,NA,NA,NA,NA
"61","Boyle, Soames; White, Richard H.; Brunson, Ann; Wun, Ted",2013,"Splenectomy and the incidence of venous thromboembolism and sepsis in patients with immune thrombocytopenia.",0,0,NA,5,0,NA,NA,NA,NA,NA,NA,NA,NA,NA,NA,NA,NA,NA,NA,NA,NA,NA,NA,NA,NA,NA,NA,NA,NA,NA,NA,NA,NA,NA,NA,NA,NA,NA,NA,NA,NA,NA,NA,NA,NA,NA,NA,NA,NA,NA,NA,NA,NA,NA,NA,NA,NA,NA,NA,NA,NA
