"id","author","pub.year","title","inc.abst.ahe","inc.abst.sem","inc.full.read","reason","found.by.ref","country","coding.sys","sepsis.def","org.fail.def","data.source","sample.frac.n.units","stud.pop.size","ex.crit.A","ex.crit.B","ex.crit.C","int.valid","study.year.1","study.year.2","study.year.3","study.year.4","study.year.5","study.year.6","study.year.7","study.year.8","study.year.9","study.year.10","study.year.11","avg.age.1","avg.age.2","avg.age.3","avg.age.4","avg.age.5","avg.age.6","avg.age.7","avg.age.8","avg.age.9","avg.age.10","avg.age.11","incid.1","incid.2","incid.3","incid.4","incid.5","incid.6","incid.7","incid.8","incid.9","incid.10","incid.11","severe.incid.1","severe.incid.2","severe.incid.3","severe.incid.4","severe.incid.5","severe.incid.6","severe.incid.7","severe.incid.8","severe.incid.9","severe.incid.10","severe.incid.11","note"
"314","Panda, Madhumita; Sahoo, Prakash K.; Mohapatra, Alok Das; Dutta, Soumya kanti; Thatoi, Pravat K.; Tripathy, Rina; Das, Bidyut K.; Satpathy, Ashok K.; Ravindran, Balachandran",2013,"Decreased prevalence of sepsis but not mild or severe P. falciparum malaria is associated with pre-existing filarial infection.",0,0,NA,2,0,NA,NA,NA,NA,NA,NA,NA,NA,NA,NA,NA,NA,NA,NA,NA,NA,NA,NA,NA,NA,NA,NA,NA,NA,NA,NA,NA,NA,NA,NA,NA,NA,NA,NA,NA,NA,NA,NA,NA,NA,NA,NA,NA,NA,NA,NA,NA,NA,NA,NA,NA,NA,NA,NA,NA,NA
"315","Parravicini, Elvira; van de Ven, Carmella; Anderson, Lauren; Cairo, Mitchell S.",2002,"Myeloid hematopoietic growth factors and their role in prevention and/or treatment of neonatal sepsis.",0,0,NA,3,0,NA,NA,NA,NA,NA,NA,NA,NA,NA,NA,NA,NA,NA,NA,NA,NA,NA,NA,NA,NA,NA,NA,NA,NA,NA,NA,NA,NA,NA,NA,NA,NA,NA,NA,NA,NA,NA,NA,NA,NA,NA,NA,NA,NA,NA,NA,NA,NA,NA,NA,NA,NA,NA,NA,NA,NA
"316","Peralta-Carcelen, M.; Fargason, C. A. Jr; Coston, D.; Dolan, J. G.",1997,"Preferences of pregnant women and physicians for 2 strategies for prevention of early-onset group B streptococcal sepsis in neonates.",0,0,NA,2,0,NA,NA,NA,NA,NA,NA,NA,NA,NA,NA,NA,NA,NA,NA,NA,NA,NA,NA,NA,NA,NA,NA,NA,NA,NA,NA,NA,NA,NA,NA,NA,NA,NA,NA,NA,NA,NA,NA,NA,NA,NA,NA,NA,NA,NA,NA,NA,NA,NA,NA,NA,NA,NA,NA,NA,NA
"317","Pers, C.; Gahrn-Hansen, B.; Frederiksen, W.",1996,"Capnocytophaga canimorsus septicemia in Denmark, 1982-1995: review of 39 cases.",0,0,NA,1,0,NA,NA,NA,NA,NA,NA,NA,NA,NA,NA,NA,NA,NA,NA,NA,NA,NA,NA,NA,NA,NA,NA,NA,NA,NA,NA,NA,NA,NA,NA,NA,NA,NA,NA,NA,NA,NA,NA,NA,NA,NA,NA,NA,NA,NA,NA,NA,NA,NA,NA,NA,NA,NA,NA,NA,NA
"318","Petersen, R.; Hannerz, H.; Tuchsen, F.; Egerton, J. R.",2011,"Meningitis, sepsis and endocarditis among workers occupationally exposed to pigs.",0,0,NA,13,0,NA,NA,NA,NA,NA,NA,NA,NA,NA,NA,NA,NA,NA,NA,NA,NA,NA,NA,NA,NA,NA,NA,NA,NA,NA,NA,NA,NA,NA,NA,NA,NA,NA,NA,NA,NA,NA,NA,NA,NA,NA,NA,NA,NA,NA,NA,NA,NA,NA,NA,NA,NA,NA,NA,NA,NA
"319","Pichler, J.; Horn, V.; Macdonald, S.; Hill, S.",2010,"Sepsis and its etiology among hospitalized children less than 1 year of age with  intestinal failure on parenteral nutrition.",0,0,NA,7,0,NA,NA,NA,NA,NA,NA,NA,NA,NA,NA,NA,NA,NA,NA,NA,NA,NA,NA,NA,NA,NA,NA,NA,NA,NA,NA,NA,NA,NA,NA,NA,NA,NA,NA,NA,NA,NA,NA,NA,NA,NA,NA,NA,NA,NA,NA,NA,NA,NA,NA,NA,NA,NA,NA,NA,NA
"320","Pietropaoli, Anthony P.; Glance, Laurent G.; Oakes, David; Fisher, Susan G.",2010,"Gender differences in mortality in patients with severe sepsis or septic shock.",0,0,NA,2,0,NA,NA,NA,NA,NA,NA,NA,NA,NA,NA,NA,NA,NA,NA,NA,NA,NA,NA,NA,NA,NA,NA,NA,NA,NA,NA,NA,NA,NA,NA,NA,NA,NA,NA,NA,NA,NA,NA,NA,NA,NA,NA,NA,NA,NA,NA,NA,NA,NA,NA,NA,NA,NA,NA,NA,NA
"321","Pittet, D.; Rangel-Frausto, S.; Li, N.; Tarara, D.; Costigan, M.; Rempe, L.; Jebson, P.; Wenzel, R. P.",1995,"Systemic inflammatory response syndrome, sepsis, severe sepsis and septic shock:  incidence, morbidities and outcomes in surgical ICU patients.",0,0,NA,2,0,NA,NA,NA,NA,NA,NA,NA,NA,NA,NA,NA,NA,NA,NA,NA,NA,NA,NA,NA,NA,NA,NA,NA,NA,NA,NA,NA,NA,NA,NA,NA,NA,NA,NA,NA,NA,NA,NA,NA,NA,NA,NA,NA,NA,NA,NA,NA,NA,NA,NA,NA,NA,NA,NA,NA,NA
"322","Plantefeve, G.; Hellmann, R.; Pajot, O.; Thirion, M.; Bleichner, G.; Mentec, H.",2007,"Abdominal compartment syndrome and intraabdominal sepsis: two of the same kind?",0,0,NA,1,0,NA,NA,NA,NA,NA,NA,NA,NA,NA,NA,NA,NA,NA,NA,NA,NA,NA,NA,NA,NA,NA,NA,NA,NA,NA,NA,NA,NA,NA,NA,NA,NA,NA,NA,NA,NA,NA,NA,NA,NA,NA,NA,NA,NA,NA,NA,NA,NA,NA,NA,NA,NA,NA,NA,NA,NA
"323","Poeze, Martijn; Ramsay, Graham; Gerlach, Herwig; Rubulotta, Francesca; Levy, Mitchel",2004,"An international sepsis survey: a study of doctors' knowledge and perception about sepsis.",0,0,NA,1,0,NA,NA,NA,NA,NA,NA,NA,NA,NA,NA,NA,NA,NA,NA,NA,NA,NA,NA,NA,NA,NA,NA,NA,NA,NA,NA,NA,NA,NA,NA,NA,NA,NA,NA,NA,NA,NA,NA,NA,NA,NA,NA,NA,NA,NA,NA,NA,NA,NA,NA,NA,NA,NA,NA,NA,NA
"324","Poindexter, Brenda B.; Ehrenkranz, Richard A.; Stoll, Barbara J.; Wright, Linda L.; Poole, W. Kenneth; Oh, William; Bauer, Charles R.; Papile, Lu-Ann; Tyson, Jon E.; Carlo, Waldemar A.; Laptook, Abbot R.; Narendran, Vivek; Stevenson, David K.; Fanaroff, Avroy A.; Korones, Sheldon B.; Shankaran, Seetha; Finer, Neil N.; Lemons, James A.",2004,"Parenteral glutamine supplementation does not reduce the risk of mortality or late-onset sepsis in extremely low birth weight infants.",0,0,NA,2,0,NA,NA,NA,NA,NA,NA,NA,NA,NA,NA,NA,NA,NA,NA,NA,NA,NA,NA,NA,NA,NA,NA,NA,NA,NA,NA,NA,NA,NA,NA,NA,NA,NA,NA,NA,NA,NA,NA,NA,NA,NA,NA,NA,NA,NA,NA,NA,NA,NA,NA,NA,NA,NA,NA,NA,NA
"325","Poukkanen, M.; Vaara, S. T.; Pettila, V.; Kaukonen, K.-M.; Korhonen, A.-M.; Hovilehto, S.; Inkinen, O.; Laru-Sompa, R.; Kaminski, T.; Reinikainen, M.; Lund, V.; Karlsson, S.",2013,"Acute kidney injury in patients with severe sepsis in Finnish Intensive Care Units.",0,0,NA,2,0,NA,NA,NA,NA,NA,NA,NA,NA,NA,NA,NA,NA,NA,NA,NA,NA,NA,NA,NA,NA,NA,NA,NA,NA,NA,NA,NA,NA,NA,NA,NA,NA,NA,NA,NA,NA,NA,NA,NA,NA,NA,NA,NA,NA,NA,NA,NA,NA,NA,NA,NA,NA,NA,NA,NA,NA
"326","Poutsiaka, Debra D.; Davidson, Lisa E.; Kahn, Katherine L.; Bates, David W.; Snydman, David R.; Hibberd, Patricia L.",2009,"Risk factors for death after sepsis in patients immunosuppressed before the onset of sepsis.",0,0,NA,2,0,NA,NA,NA,NA,NA,NA,NA,NA,NA,NA,NA,NA,NA,NA,NA,NA,NA,NA,NA,NA,NA,NA,NA,NA,NA,NA,NA,NA,NA,NA,NA,NA,NA,NA,NA,NA,NA,NA,NA,NA,NA,NA,NA,NA,NA,NA,NA,NA,NA,NA,NA,NA,NA,NA,NA,NA
"327","Powe, N. R.; Jaar, B.; Furth, S. L.; Hermann, J.; Briggs, W.",1999,"Septicemia in dialysis patients: incidence, risk factors, and prognosis.",0,0,NA,12,0,NA,NA,NA,NA,NA,NA,NA,NA,NA,NA,NA,NA,NA,NA,NA,NA,NA,NA,NA,NA,NA,NA,NA,NA,NA,NA,NA,NA,NA,NA,NA,NA,NA,NA,NA,NA,NA,NA,NA,NA,NA,NA,NA,NA,NA,NA,NA,NA,NA,NA,NA,NA,NA,NA,NA,NA
"328","Powell, Emilie S.; Sauser, Kori; Cheema, Navneet; Pirotte, Matthew J.; Quattromani, Erin; Avula, Umakanth; Khare, Rahul K.; Courtney, D. Mark",2013,"Severe sepsis in do-not-resuscitate patients: intervention and mortality rates.",0,0,NA,2,0,NA,NA,NA,NA,NA,NA,NA,NA,NA,NA,NA,NA,NA,NA,NA,NA,NA,NA,NA,NA,NA,NA,NA,NA,NA,NA,NA,NA,NA,NA,NA,NA,NA,NA,NA,NA,NA,NA,NA,NA,NA,NA,NA,NA,NA,NA,NA,NA,NA,NA,NA,NA,NA,NA,NA,NA
"329","Prasertsom, W.; Horpaopan, S.; Ratrisawadi, V.; Puapondh, Y.; Thanasophon, Y.; Trakulchang, K.",1990,"Early versus late onset neonatal septicemia at Children's Hospital.",0,0,NA,3,0,NA,NA,NA,NA,NA,NA,NA,NA,NA,NA,NA,NA,NA,NA,NA,NA,NA,NA,NA,NA,NA,NA,NA,NA,NA,NA,NA,NA,NA,NA,NA,NA,NA,NA,NA,NA,NA,NA,NA,NA,NA,NA,NA,NA,NA,NA,NA,NA,NA,NA,NA,NA,NA,NA,NA,NA
"330","Proulx, F.; Fayon, M.; Farrell, C. A.; Lacroix, J.; Gauthier, M.",1996,"Epidemiology of sepsis and multiple organ dysfunction syndrome in children.",0,0,NA,7,0,NA,NA,NA,NA,NA,NA,NA,NA,NA,NA,NA,NA,NA,NA,NA,NA,NA,NA,NA,NA,NA,NA,NA,NA,NA,NA,NA,NA,NA,NA,NA,NA,NA,NA,NA,NA,NA,NA,NA,NA,NA,NA,NA,NA,NA,NA,NA,NA,NA,NA,NA,NA,NA,NA,NA,NA
"331","Prucha, M.; Zazula, R.; Herold, I.; Dostal, M.; Hyanek, T.; Bellingan, G.",2013,"Presence of hypogammaglobulinemia - a risk factor of mortality in patients with severe sepsis, septic shock, and SIRS.",0,0,NA,2,0,NA,NA,NA,NA,NA,NA,NA,NA,NA,NA,NA,NA,NA,NA,NA,NA,NA,NA,NA,NA,NA,NA,NA,NA,NA,NA,NA,NA,NA,NA,NA,NA,NA,NA,NA,NA,NA,NA,NA,NA,NA,NA,NA,NA,NA,NA,NA,NA,NA,NA,NA,NA,NA,NA,NA,NA
"332","Puopolo, Karen M.; Eichenwald, Eric C.",2010,"No change in the incidence of ampicillin-resistant, neonatal, early-onset sepsis  over 18 years.",0,0,NA,1,0,NA,NA,NA,NA,NA,NA,NA,NA,NA,NA,NA,NA,NA,NA,NA,NA,NA,NA,NA,NA,NA,NA,NA,NA,NA,NA,NA,NA,NA,NA,NA,NA,NA,NA,NA,NA,NA,NA,NA,NA,NA,NA,NA,NA,NA,NA,NA,NA,NA,NA,NA,NA,NA,NA,NA,NA
"333","Qari, Faiza A.",2003,"Bacteremia and septicemia in diabetic patients in Western Saudi Arabia.",0,0,NA,4,0,NA,NA,NA,NA,NA,NA,NA,NA,NA,NA,NA,NA,NA,NA,NA,NA,NA,NA,NA,NA,NA,NA,NA,NA,NA,NA,NA,NA,NA,NA,NA,NA,NA,NA,NA,NA,NA,NA,NA,NA,NA,NA,NA,NA,NA,NA,NA,NA,NA,NA,NA,NA,NA,NA,NA,NA
"334","Quilty, S.; Kwok, G.; Hajkowicz, K.; Currie, B.",2009,"High incidence of methicillin-resistant Staphylococcus aureus sepsis and death in patients with febrile neutropenia at Royal Darwin Hospital.",0,0,NA,0,0,NA,NA,NA,NA,NA,NA,NA,NA,NA,NA,NA,NA,NA,NA,NA,NA,NA,NA,NA,NA,NA,NA,NA,NA,NA,NA,NA,NA,NA,NA,NA,NA,NA,NA,NA,NA,NA,NA,NA,NA,NA,NA,NA,NA,NA,NA,NA,NA,NA,NA,NA,NA,NA,NA,NA,NA
"335","Ramanathan, Rajesh; Leavell, Patricia; Stockslager, Gregory; Mays, Catherine; Harvey, Dale; Duane, Therese M.",2014,"Validity of International Classification of Diseases, Ninth Revision, Clinical Modification (ICD-9-CM) screening for sepsis in surgical mortalities.",0,0,NA,2,0,NA,NA,NA,NA,NA,NA,NA,NA,NA,NA,NA,NA,NA,NA,NA,NA,NA,NA,NA,NA,NA,NA,NA,NA,NA,NA,NA,NA,NA,NA,NA,NA,NA,NA,NA,NA,NA,NA,NA,NA,NA,NA,NA,NA,NA,NA,NA,NA,NA,NA,NA,NA,NA,NA,NA,NA
"336","Reinhart, Konrad; Gluck, Thomas; Ligtenberg, Jack; Tschaikowsky, Klaus; Bruining, Albert; Bakker, Jan; Opal, Steven; Moldawer, Lyle L.; Axtelle, Tim; Turner, Terence; Souza, Sonia; Pribble, John",2004,"CD14 receptor occupancy in severe sepsis: results of a phase I clinical trial with a recombinant chimeric CD14 monoclonal antibody (IC14).",0,0,NA,2,0,NA,NA,NA,NA,NA,NA,NA,NA,NA,NA,NA,NA,NA,NA,NA,NA,NA,NA,NA,NA,NA,NA,NA,NA,NA,NA,NA,NA,NA,NA,NA,NA,NA,NA,NA,NA,NA,NA,NA,NA,NA,NA,NA,NA,NA,NA,NA,NA,NA,NA,NA,NA,NA,NA,NA,NA
"337","Ren, Jianan; Zhao, Yunzhao; Yuan, Yujie; Han, Gang; Li, Weiqin; Huang, Qian; Tong, Zhihui; Li, Jieshou",2012,"Complement depletion deteriorates clinical outcomes of severe abdominal sepsis: a conspirator of infection and coagulopathy in crime?",0,0,NA,2,0,NA,NA,NA,NA,NA,NA,NA,NA,NA,NA,NA,NA,NA,NA,NA,NA,NA,NA,NA,NA,NA,NA,NA,NA,NA,NA,NA,NA,NA,NA,NA,NA,NA,NA,NA,NA,NA,NA,NA,NA,NA,NA,NA,NA,NA,NA,NA,NA,NA,NA,NA,NA,NA,NA,NA,NA
"338","Rico, Rebeca M.; Ripamonti, Renato; Burns, Aime L.; Gamelli, Richard L.; DiPietro, Luisa A.",2002,"The effect of sepsis on wound healing.",0,0,NA,2,0,NA,NA,NA,NA,NA,NA,NA,NA,NA,NA,NA,NA,NA,NA,NA,NA,NA,NA,NA,NA,NA,NA,NA,NA,NA,NA,NA,NA,NA,NA,NA,NA,NA,NA,NA,NA,NA,NA,NA,NA,NA,NA,NA,NA,NA,NA,NA,NA,NA,NA,NA,NA,NA,NA,NA,NA
"339","Rixen, D.; Siegel, J. H.; Espina, N.; Bertolini, M.",1997,"Plasma nitric oxide in posttrauma critical illness: a function of ""sepsis"" and the physiologic state severity classification quantifying the probability of death.",0,0,NA,2,0,NA,NA,NA,NA,NA,NA,NA,NA,NA,NA,NA,NA,NA,NA,NA,NA,NA,NA,NA,NA,NA,NA,NA,NA,NA,NA,NA,NA,NA,NA,NA,NA,NA,NA,NA,NA,NA,NA,NA,NA,NA,NA,NA,NA,NA,NA,NA,NA,NA,NA,NA,NA,NA,NA,NA,NA
"340","Robillard, P. Y.; Nabeth, P.; Hulsey, T. C.; Sergent, M. P.; Perianin, J.; Janky, E.",1993,"Neonatal bacterial septicemia in a tropical area. Four-year experience in Guadeloupe (French West Indies).",0,0,NA,3,0,NA,NA,NA,NA,NA,NA,NA,NA,NA,NA,NA,NA,NA,NA,NA,NA,NA,NA,NA,NA,NA,NA,NA,NA,NA,NA,NA,NA,NA,NA,NA,NA,NA,NA,NA,NA,NA,NA,NA,NA,NA,NA,NA,NA,NA,NA,NA,NA,NA,NA,NA,NA,NA,NA,NA,NA
"341","Robson, Wayne; Newell, Julian",2005,"Assessing, treating and managing patients with sepsis.",0,0,NA,2,0,NA,NA,NA,NA,NA,NA,NA,NA,NA,NA,NA,NA,NA,NA,NA,NA,NA,NA,NA,NA,NA,NA,NA,NA,NA,NA,NA,NA,NA,NA,NA,NA,NA,NA,NA,NA,NA,NA,NA,NA,NA,NA,NA,NA,NA,NA,NA,NA,NA,NA,NA,NA,NA,NA,NA,NA
"342","Rodeghiero, F.; Frezzato, M.; Schiavotto, C.; Castaman, G.; Dini, E.",1992,"Fulminant sepsis in adults splenectomized for idiopathic thrombocytopenic purpura.",0,0,NA,5,0,NA,NA,NA,NA,NA,NA,NA,NA,NA,NA,NA,NA,NA,NA,NA,NA,NA,NA,NA,NA,NA,NA,NA,NA,NA,NA,NA,NA,NA,NA,NA,NA,NA,NA,NA,NA,NA,NA,NA,NA,NA,NA,NA,NA,NA,NA,NA,NA,NA,NA,NA,NA,NA,NA,NA,NA
"343","Roilides, E.; Kyriakides, G.; Kadiltsoglou, I.; Farmaki, E.; Venzon, D.; Katsaveli, A.; Kremenopoulos, G.",2000,"Septicemia due to multiresistant Klebsiella pneumoniae in a neonatal unit: a case-control study.",0,0,NA,2,0,NA,NA,NA,NA,NA,NA,NA,NA,NA,NA,NA,NA,NA,NA,NA,NA,NA,NA,NA,NA,NA,NA,NA,NA,NA,NA,NA,NA,NA,NA,NA,NA,NA,NA,NA,NA,NA,NA,NA,NA,NA,NA,NA,NA,NA,NA,NA,NA,NA,NA,NA,NA,NA,NA,NA,NA
"344","Ronnestad, Arild; Abrahamsen, Tore G.; Medbo, Sverre; Reigstad, Hallvard; Lossius, Kristin; Kaaresen, Per I.; Egeland, Thore; Engelund, Inger E.; Irgens, Lorentz M.; Markestad, Trond",2005,"Late-onset septicemia in a Norwegian national cohort of extremely premature infants receiving very early full human milk feeding.",0,0,NA,3,0,NA,NA,NA,NA,NA,NA,NA,NA,NA,NA,NA,NA,NA,NA,NA,NA,NA,NA,NA,NA,NA,NA,NA,NA,NA,NA,NA,NA,NA,NA,NA,NA,NA,NA,NA,NA,NA,NA,NA,NA,NA,NA,NA,NA,NA,NA,NA,NA,NA,NA,NA,NA,NA,NA,NA,NA
"345","Ronnestad, Arild; Abrahamsen, Tore G.; Medbo, Sverre; Reigstad, Hallvard; Lossius, Kristin; Kaaresen, Per I.; Engelund, Inger E.; Irgens, Lorentz M.; Markestad, Trond",2005,"Septicemia in the first week of life in a Norwegian national cohort of extremely  premature infants.",0,0,NA,3,0,NA,NA,NA,NA,NA,NA,NA,NA,NA,NA,NA,NA,NA,NA,NA,NA,NA,NA,NA,NA,NA,NA,NA,NA,NA,NA,NA,NA,NA,NA,NA,NA,NA,NA,NA,NA,NA,NA,NA,NA,NA,NA,NA,NA,NA,NA,NA,NA,NA,NA,NA,NA,NA,NA,NA,NA
"346","Roongpisuthipong, Chulaporn; Getupook, Vittanee; Chindavijak, Busba",2007,"Impact of a new guideline for central venous catheter care on sepsis in total parenteral nutrition: experience in Ramathibodi Hospital.",0,0,NA,5,0,NA,NA,NA,NA,NA,NA,NA,NA,NA,NA,NA,NA,NA,NA,NA,NA,NA,NA,NA,NA,NA,NA,NA,NA,NA,NA,NA,NA,NA,NA,NA,NA,NA,NA,NA,NA,NA,NA,NA,NA,NA,NA,NA,NA,NA,NA,NA,NA,NA,NA,NA,NA,NA,NA,NA,NA
"347","Rosenberg, Philip S.; Alter, Blanche P.; Bolyard, Audrey A.; Bonilla, Mary Ann; Boxer, Laurence A.; Cham, Bonnie; Fier, Carol; Freedman, Melvin; Kannourakis, George; Kinsey, Sally; Schwinzer, Beate; Zeidler, Connie; Welte, Karl; Dale, David C.",2006,"The incidence of leukemia and mortality from sepsis in patients with severe congenital neutropenia receiving long-term G-CSF therapy.",0,0,NA,2,0,NA,NA,NA,NA,NA,NA,NA,NA,NA,NA,NA,NA,NA,NA,NA,NA,NA,NA,NA,NA,NA,NA,NA,NA,NA,NA,NA,NA,NA,NA,NA,NA,NA,NA,NA,NA,NA,NA,NA,NA,NA,NA,NA,NA,NA,NA,NA,NA,NA,NA,NA,NA,NA,NA,NA,NA
"348","Rubio, M.; Palau, L.; Vivas, J. R.; del Potro, E.; Diaz-Mediavilla, J.; Alvarez, A.; Martinez, R.; Picazo, J. J.",1994,"Predominance of gram-positive microorganisms as a cause of septicemia in patients with hematological malignancies.",0,0,NA,2,0,NA,NA,NA,NA,NA,NA,NA,NA,NA,NA,NA,NA,NA,NA,NA,NA,NA,NA,NA,NA,NA,NA,NA,NA,NA,NA,NA,NA,NA,NA,NA,NA,NA,NA,NA,NA,NA,NA,NA,NA,NA,NA,NA,NA,NA,NA,NA,NA,NA,NA,NA,NA,NA,NA,NA,NA
"349","Ryozawa, Manami; Matsubara, Tomoyo; Ichiyama, Takashi; Umeda, Kaoru; Furukawa, Susumu",2007,"Clinical sepsis in neonates is responsible for the lower prevalence of developing allergy.",0,0,NA,3,0,NA,NA,NA,NA,NA,NA,NA,NA,NA,NA,NA,NA,NA,NA,NA,NA,NA,NA,NA,NA,NA,NA,NA,NA,NA,NA,NA,NA,NA,NA,NA,NA,NA,NA,NA,NA,NA,NA,NA,NA,NA,NA,NA,NA,NA,NA,NA,NA,NA,NA,NA,NA,NA,NA,NA,NA
"350","Sakr, Y.; Elia, C.; Mascia, L.; Barberis, B.; Cardellino, S.; Livigni, S.; Fiore, G.; Filippini, C.; Ranieri, V. M.",2013,"Epidemiology and outcome of sepsis syndromes in Italian ICUs: a muticentre, observational cohort study in the region of Piedmont.",0,0,NA,15,0,NA,NA,NA,NA,NA,NA,NA,NA,NA,NA,NA,NA,NA,NA,NA,NA,NA,NA,NA,NA,NA,NA,NA,NA,NA,NA,NA,NA,NA,NA,NA,NA,NA,NA,NA,NA,NA,NA,NA,NA,NA,NA,NA,NA,NA,NA,NA,NA,NA,NA,NA,NA,NA,NA,NA,NA
"351","Sakr, Yasser; Vincent, Jean-Louis; Ruokonen, Esko; Pizzamiglio, Mario; Installe, Etienne; Reinhart, Konrad; Moreno, Rui",2008,"Sepsis and organ system failure are major determinants of post-intensive care unit mortality.",0,0,NA,2,0,NA,NA,NA,NA,NA,NA,NA,NA,NA,NA,NA,NA,NA,NA,NA,NA,NA,NA,NA,NA,NA,NA,NA,NA,NA,NA,NA,NA,NA,NA,NA,NA,NA,NA,NA,NA,NA,NA,NA,NA,NA,NA,NA,NA,NA,NA,NA,NA,NA,NA,NA,NA,NA,NA,NA,NA
"352","Saleem, Ali Faisal; Qamar, Farah Naz; Shahzad, Hira; Qadir, Maqbool; Zaidi, Anita K. M.",2013,"Trends in antibiotic susceptibility and incidence of late-onset Klebsiella pneumoniae neonatal sepsis over a six-year period in a neonatal intensive care unit in Karachi, Pakistan.",0,0,NA,3,0,NA,NA,NA,NA,NA,NA,NA,NA,NA,NA,NA,NA,NA,NA,NA,NA,NA,NA,NA,NA,NA,NA,NA,NA,NA,NA,NA,NA,NA,NA,NA,NA,NA,NA,NA,NA,NA,NA,NA,NA,NA,NA,NA,NA,NA,NA,NA,NA,NA,NA,NA,NA,NA,NA,NA,NA
"353","Salutari, P.; Sica, S.; Laurenti, L.; Leone, F.; Chiusolo, P.; Piccirillo, N.; Micciulli, G.; Leone, G.",1998,"Incidence of sepsis after peripheral blood progenitor cells transplantation: analysis of 86 consecutive hemato oncological patients.",0,0,NA,5,0,NA,NA,NA,NA,NA,NA,NA,NA,NA,NA,NA,NA,NA,NA,NA,NA,NA,NA,NA,NA,NA,NA,NA,NA,NA,NA,NA,NA,NA,NA,NA,NA,NA,NA,NA,NA,NA,NA,NA,NA,NA,NA,NA,NA,NA,NA,NA,NA,NA,NA,NA,NA,NA,NA,NA,NA
"354","Salvo, I.; de Cian, W.; Musicco, M.; Langer, M.; Piadena, R.; Wolfler, A.; Montani, C.; Magni, E.",1995,"The Italian SEPSIS study: preliminary results on the incidence and evolution of SIRS, sepsis, severe sepsis and septic shock.",0,0,NA,2,0,NA,NA,NA,NA,NA,NA,NA,NA,NA,NA,NA,NA,NA,NA,NA,NA,NA,NA,NA,NA,NA,NA,NA,NA,NA,NA,NA,NA,NA,NA,NA,NA,NA,NA,NA,NA,NA,NA,NA,NA,NA,NA,NA,NA,NA,NA,NA,NA,NA,NA,NA,NA,NA,NA,NA,NA
"355","Sammon, Jesse D.; Klett, Dane E.; Sood, Akshay; Olugbade, Kola Jr; Schmid, Marianne; Kim, Simon P.; Menon, Mani; Trinh, Quoc-Dien",2015,"Sepsis after major cancer surgery.",0,0,NA,15,0,NA,NA,NA,NA,NA,NA,NA,NA,NA,NA,NA,NA,NA,NA,NA,NA,NA,NA,NA,NA,NA,NA,NA,NA,NA,NA,NA,NA,NA,NA,NA,NA,NA,NA,NA,NA,NA,NA,NA,NA,NA,NA,NA,NA,NA,NA,NA,NA,NA,NA,NA,NA,NA,NA,NA,NA
"356","Sander, J.",1969,"Changes in incidence and etiology of septicemia in an infectious unit.",0,0,NA,16,0,NA,NA,NA,NA,NA,NA,NA,NA,NA,NA,NA,NA,NA,NA,NA,NA,NA,NA,NA,NA,NA,NA,NA,NA,NA,NA,NA,NA,NA,NA,NA,NA,NA,NA,NA,NA,NA,NA,NA,NA,NA,NA,NA,NA,NA,NA,NA,NA,NA,NA,NA,NA,NA,NA,NA,NA
"357","Sands, K. E.; Bates, D. W.; Lanken, P. N.; Graman, P. S.; Hibberd, P. L.; Kahn, K. L.; Parsonnet, J.; Panzer, R.; Orav, E. J.; Snydman, D. R.; Black, E.; Schwartz, J. S.; Moore, R.; Jr, B. L. Johnson; Platt, R.; Group, Academic Medical Center Consortium Sepsis Project Working",1997,"Epidemiology of sepsis syndrome in 8 academic medical centers",0,0,NA,19,1,NA,NA,NA,NA,NA,NA,NA,NA,NA,NA,NA,NA,NA,NA,NA,NA,NA,NA,NA,NA,NA,NA,NA,NA,NA,NA,NA,NA,NA,NA,NA,NA,NA,NA,NA,NA,NA,NA,NA,NA,NA,NA,NA,NA,NA,NA,NA,NA,NA,NA,NA,NA,NA,NA,NA,NA
"358","Sankar, M. Jeeva; Agarwal, Ramesh; Deorari, Ashok K.; Paul, Vinod K.",2008,"Sepsis in the newborn.",0,0,NA,0,0,NA,NA,NA,NA,NA,NA,NA,NA,NA,NA,NA,NA,NA,NA,NA,NA,NA,NA,NA,NA,NA,NA,NA,NA,NA,NA,NA,NA,NA,NA,NA,NA,NA,NA,NA,NA,NA,NA,NA,NA,NA,NA,NA,NA,NA,NA,NA,NA,NA,NA,NA,NA,NA,NA,NA,NA
"359","Santarpia, Lidia; Pasanisi, Fabrizio; Alfonsi, Lucia; Violante, Gerardo; Tiseo, Domenico; De Simone, Gianni; Contaldo, Franco",2002,"Prevention and treatment of implanted central venous catheter (CVC) - related sepsis: a report after six years of home parenteral nutrition (HPN).",0,0,NA,2,0,NA,NA,NA,NA,NA,NA,NA,NA,NA,NA,NA,NA,NA,NA,NA,NA,NA,NA,NA,NA,NA,NA,NA,NA,NA,NA,NA,NA,NA,NA,NA,NA,NA,NA,NA,NA,NA,NA,NA,NA,NA,NA,NA,NA,NA,NA,NA,NA,NA,NA,NA,NA,NA,NA,NA,NA
"360","Saturnino, Saulo F.; Andrade, Marcus V.",2007,"Toll-like receptors, new horizons in sepsis.",1,0,0,20,0,NA,NA,NA,NA,NA,NA,NA,NA,NA,NA,NA,NA,NA,NA,NA,NA,NA,NA,NA,NA,NA,NA,NA,NA,NA,NA,NA,NA,NA,NA,NA,NA,NA,NA,NA,NA,NA,NA,NA,NA,NA,NA,NA,NA,NA,NA,NA,NA,NA,NA,NA,NA,NA,NA,NA,NA
"361","Scheckler, W. E.; Scheibel, W.; Kresge, D.",1991,"Temporal trends in septicemia in a community hospital.",0,0,NA,19,0,NA,NA,NA,NA,NA,NA,NA,NA,NA,NA,NA,NA,NA,NA,NA,NA,NA,NA,NA,NA,NA,NA,NA,NA,NA,NA,NA,NA,NA,NA,NA,NA,NA,NA,NA,NA,NA,NA,NA,NA,NA,NA,NA,NA,NA,NA,NA,NA,NA,NA,NA,NA,NA,NA,NA,NA
"362","Scheckler, W. E.",1978,"Septicemia and nosocomial infections in a community hospital.",1,0,0,20,0,NA,NA,NA,NA,NA,NA,NA,NA,NA,NA,NA,NA,NA,NA,NA,NA,NA,NA,NA,NA,NA,NA,NA,NA,NA,NA,NA,NA,NA,NA,NA,NA,NA,NA,NA,NA,NA,NA,NA,NA,NA,NA,NA,NA,NA,NA,NA,NA,NA,NA,NA,NA,NA,NA,NA,NA
"363","Scheckler, W. E.",1977,"Septicemia in a Community Hospital 1970 through 1973.",1,0,0,19,0,NA,NA,NA,NA,NA,NA,NA,NA,NA,NA,NA,NA,NA,NA,NA,NA,NA,NA,NA,NA,NA,NA,NA,NA,NA,NA,NA,NA,NA,NA,NA,NA,NA,NA,NA,NA,NA,NA,NA,NA,NA,NA,NA,NA,NA,NA,NA,NA,NA,NA,NA,NA,NA,NA,NA,NA
"364","Scheier, Eric; Aviner, Shraga",2013,"Septicemia following rotavirus gastroenteritis.",0,0,NA,1,0,NA,NA,NA,NA,NA,NA,NA,NA,NA,NA,NA,NA,NA,NA,NA,NA,NA,NA,NA,NA,NA,NA,NA,NA,NA,NA,NA,NA,NA,NA,NA,NA,NA,NA,NA,NA,NA,NA,NA,NA,NA,NA,NA,NA,NA,NA,NA,NA,NA,NA,NA,NA,NA,NA,NA,NA
"365","Schimpff, S. C.; Greene, W. H.; Young, V. M.; Wiernik, P. H.",1973,"Pseudomonas septicemia: incidence, epidemiology, prevention and therapy in patients with advanced cancer.",1,0,0,20,0,NA,NA,NA,NA,NA,NA,NA,NA,NA,NA,NA,NA,NA,NA,NA,NA,NA,NA,NA,NA,NA,NA,NA,NA,NA,NA,NA,NA,NA,NA,NA,NA,NA,NA,NA,NA,NA,NA,NA,NA,NA,NA,NA,NA,NA,NA,NA,NA,NA,NA,NA,NA,NA,NA,NA,NA
"366","Schlapbach, Luregn J.; Aebischer, Maude; Adams, Mark; Natalucci, Giancarlo; Bonhoeffer, Jan; Latzin, Philipp; Nelle, Mathias; Bucher, Hans Ulrich; Latal, Beatrice",2011,"Impact of sepsis on neurodevelopmental outcome in a Swiss National Cohort of extremely premature infants.",0,0,NA,2,0,NA,NA,NA,NA,NA,NA,NA,NA,NA,NA,NA,NA,NA,NA,NA,NA,NA,NA,NA,NA,NA,NA,NA,NA,NA,NA,NA,NA,NA,NA,NA,NA,NA,NA,NA,NA,NA,NA,NA,NA,NA,NA,NA,NA,NA,NA,NA,NA,NA,NA,NA,NA,NA,NA,NA,NA
"367","Schlapbach, Luregn J.; Straney, Lahn; Alexander, Janet; MacLaren, Graeme; Festa, Marino; Schibler, Andreas; Slater, Anthony",2015,"Mortality related to invasive infections, sepsis, and septic shock in critically  ill children in Australia and New Zealand, 2002-13: a multicentre retrospective cohort study.",0,0,NA,7,0,NA,NA,NA,NA,NA,NA,NA,NA,NA,NA,NA,NA,NA,NA,NA,NA,NA,NA,NA,NA,NA,NA,NA,NA,NA,NA,NA,NA,NA,NA,NA,NA,NA,NA,NA,NA,NA,NA,NA,NA,NA,NA,NA,NA,NA,NA,NA,NA,NA,NA,NA,NA,NA,NA,NA,NA
"368","Schouten, M.; van 't Veer, C.; van der Poll, T.; Levi, M.",2012,"Effect of the factor V Leiden mutation on the incidence and outcome of severe infection and sepsis.",0,0,NA,1,0,NA,NA,NA,NA,NA,NA,NA,NA,NA,NA,NA,NA,NA,NA,NA,NA,NA,NA,NA,NA,NA,NA,NA,NA,NA,NA,NA,NA,NA,NA,NA,NA,NA,NA,NA,NA,NA,NA,NA,NA,NA,NA,NA,NA,NA,NA,NA,NA,NA,NA,NA,NA,NA,NA,NA,NA
"369","Scott, E. C.; Ho, H. C.; Yu, M.; Chapital, A. D.; Koss, W.; Takanishi, D. M. Jr",2008,"Pre-existing cardiac disease, troponin I elevation and mortality in patients with severe sepsis and septic shock.",0,0,NA,2,0,NA,NA,NA,NA,NA,NA,NA,NA,NA,NA,NA,NA,NA,NA,NA,NA,NA,NA,NA,NA,NA,NA,NA,NA,NA,NA,NA,NA,NA,NA,NA,NA,NA,NA,NA,NA,NA,NA,NA,NA,NA,NA,NA,NA,NA,NA,NA,NA,NA,NA,NA,NA,NA,NA,NA,NA
"370","Seale, Anna C.; Mwaniki, Michael; Newton, Charles R. J. C.; Berkley, James A.",2009,"Maternal and early onset neonatal bacterial sepsis: burden and strategies for prevention in sub-Saharan Africa.",0,0,NA,1,0,NA,NA,NA,NA,NA,NA,NA,NA,NA,NA,NA,NA,NA,NA,NA,NA,NA,NA,NA,NA,NA,NA,NA,NA,NA,NA,NA,NA,NA,NA,NA,NA,NA,NA,NA,NA,NA,NA,NA,NA,NA,NA,NA,NA,NA,NA,NA,NA,NA,NA,NA,NA,NA,NA,NA,NA
"371","Sedaghatian, M. R.; Jazayeri, A.; Montoya, M. F.",1977,"High incidence of septicemia in a nursery epidemic of group B salmonellosis in Shiraz-Iran.",0,0,NA,3,0,NA,NA,NA,NA,NA,NA,NA,NA,NA,NA,NA,NA,NA,NA,NA,NA,NA,NA,NA,NA,NA,NA,NA,NA,NA,NA,NA,NA,NA,NA,NA,NA,NA,NA,NA,NA,NA,NA,NA,NA,NA,NA,NA,NA,NA,NA,NA,NA,NA,NA,NA,NA,NA,NA,NA,NA
"372","Sehgal, Inderpaul Singh; Agarwal, Ritesh; Aggarwal, Ashutosh N.; Jindal, Surinder K.",2015,"A randomized trial of Mycobacterium w in severe sepsis.",0,0,NA,2,0,NA,NA,NA,NA,NA,NA,NA,NA,NA,NA,NA,NA,NA,NA,NA,NA,NA,NA,NA,NA,NA,NA,NA,NA,NA,NA,NA,NA,NA,NA,NA,NA,NA,NA,NA,NA,NA,NA,NA,NA,NA,NA,NA,NA,NA,NA,NA,NA,NA,NA,NA,NA,NA,NA,NA,NA
"373","Seror, P.; Pluvinage, P.; d'Andre, F. L.; Benamou, P.; Attuil, G.",1999,"Frequency of sepsis after local corticosteroid injection (an inquiry on 1160000 injections in rheumatological private practice in France).",0,0,NA,2,0,NA,NA,NA,NA,NA,NA,NA,NA,NA,NA,NA,NA,NA,NA,NA,NA,NA,NA,NA,NA,NA,NA,NA,NA,NA,NA,NA,NA,NA,NA,NA,NA,NA,NA,NA,NA,NA,NA,NA,NA,NA,NA,NA,NA,NA,NA,NA,NA,NA,NA,NA,NA,NA,NA,NA,NA
"374","Serpa Neto, Ary; Veelo, Denise P.; Peireira, Victor Galvao Moura; de Assuncao, Murillo Santucci Cesar; Manetta, Jose Antonio; Esposito, Daniel Crepaldi; Schultz, Marcus J.",2014,"Fluid resuscitation with hydroxyethyl starches in patients with sepsis is associated with an increased incidence of acute kidney injury and use of renal replacement therapy: a systematic review and meta-analysis of the literature.",0,0,NA,1,0,NA,NA,NA,NA,NA,NA,NA,NA,NA,NA,NA,NA,NA,NA,NA,NA,NA,NA,NA,NA,NA,NA,NA,NA,NA,NA,NA,NA,NA,NA,NA,NA,NA,NA,NA,NA,NA,NA,NA,NA,NA,NA,NA,NA,NA,NA,NA,NA,NA,NA,NA,NA,NA,NA,NA,NA
"375","Seymour, Christopher W.; Iwashyna, Theodore J.; Cooke, Colin R.; Hough, Catherine L.; Martin, Greg S.",2010,"Marital status and the epidemiology and outcomes of sepsis.",1,0,0,18,0,NA,NA,NA,NA,NA,NA,NA,NA,NA,NA,NA,NA,NA,NA,NA,NA,NA,NA,NA,NA,NA,NA,NA,NA,NA,NA,NA,NA,NA,NA,NA,NA,NA,NA,NA,NA,NA,NA,NA,NA,NA,NA,NA,NA,NA,NA,NA,NA,NA,NA,NA,NA,NA,NA,NA,NA
"376","Seymour, Christopher W.; Rea, Thomas D.; Kahn, Jeremy M.; Walkey, Allan J.; Yealy, Donald M.; Angus, Derek C.",2012,"Severe sepsis in pre-hospital emergency care: analysis of incidence, care, and outcome.",1,0,0,19,0,NA,NA,NA,NA,NA,NA,NA,NA,NA,NA,NA,NA,NA,NA,NA,NA,NA,NA,NA,NA,NA,NA,NA,NA,NA,NA,NA,NA,NA,NA,NA,NA,NA,NA,NA,NA,NA,NA,NA,NA,NA,NA,NA,NA,NA,NA,NA,NA,NA,NA,NA,NA,NA,NA,NA,NA
"377","Sgro, M.; Shah, P. S.; Campbell, D.; Tenuta, A.; Shivananda, S.; Lee, S. K.",2011,"Early-onset neonatal sepsis: rate and organism pattern between 2003 and 2008.",0,0,NA,3,0,NA,NA,NA,NA,NA,NA,NA,NA,NA,NA,NA,NA,NA,NA,NA,NA,NA,NA,NA,NA,NA,NA,NA,NA,NA,NA,NA,NA,NA,NA,NA,NA,NA,NA,NA,NA,NA,NA,NA,NA,NA,NA,NA,NA,NA,NA,NA,NA,NA,NA,NA,NA,NA,NA,NA,NA
